esse mecanismo é o equivalente geológico de um cobertor numa noite fria que aquece a atmosfera da terra <head>retendo<head> radiação do sol que de outro modo se dissiparia no espaço	retendo	guardando	segurando	conservando	mantendo	detendo	absorvendo	possuindo	contendo	trazendo	prendendo
mas escreveram eles no artigo hoje divulgado vai ser possível no futuro próximo fazer uma pele eletrônica que tenha funções que a pele humana não tem ao integrar vários <head>sensores<head> não apenas para pressão e temperatura mas também para luz umidade esforço e ultrassônicos	sensores	detectores	dispositivos	aparelhos	mecanismos que sentem	medidores
bacci pretende oferecer recompensa a chamada delação premiada a bandidos que colaborarem com as investigações para <head>desarticular<head> as grandes quadrilhas	desarticular	desmontar	separar	destruir	desfazer	desencaixar	desgastar	exarticular	luxate
naquele país a ave é considerada uma <head>praga<head>	praga	peste	epidemia	maldição	doença	desgraça	tragédia	infestação
autores de furto estariam <head>migrando<head> para o roubo	migrando	mudando	passando	deslocando-se	indo	se direcionando	deslocando	se mudando
perguntado se o protocolo de kyoto será <head>ratificado<head> no caso da eleição de um democrata para a presidência em 2008 kerry surpreendeu	ratificado	confirmado	aprovado	validado	autenticado	firmado	estipulado	corrigido
os reis magos no entanto são o oposto estão em plena forma física e representam um exemplo de <head>pluralidade<head> racial e integração	pluralidade	diversidade	variedade	numerosidade	multiplicidade	maioria	diferentes
