La novela muestra el talento de Capote para escribir comedia <head>tocada<head> por el remordimiento, y una historia carismática y llena de emoción. 	tocada	tocar	con un toque de	afectar	con un poco	impactar	con un toque
Peter Vardy El rompecabezas de la ética (Fuente - HarperCollins ISBN 0 00 627701 2) Vardy ofrece un <head>relato<head> legible de las principales teorías y hace algunas preguntas de sondeo sin mostrar ningún sesgo religioso. 	relato	relato	reporte	dar cuenta de	explicacion	cuenta	narracion	historia	resumen
(David Chaum introdujo el término combinación para describir un servicio de red que reenvía el correo después de eliminar las indicaciones estándar de la fuente, proporcionando así correo anónimo). La cantidad de dinero permite el seguimiento estadístico, pero este método puede aliviarse estableciendo una pequeña <head>cuenta<head> en el mezcla. 	cuenta	cuenta	reporte	lista
Una empresa petrolera rusa dijo que detendría los envíos a una empresa petrolera china porque la empresa rusa está en una lucha fiscal con el gobierno ruso, que congeló las <head>cuentas<head> bancarias de la empresa. 	cuentas	cuenta	cuenta bancaria
Ver / descargar imagen más grande Poner en la cesta de la compra Una bonita copia de esta fascinante colección de <head>cuentas<head>. 	cuentas	cuenta	relato	historia	explicacion	narracion	resumen
En una semana, Scotiabank dijo que había congelado algunas <head>cuentas<head> vinculadas a la lista negra de Washington. 	cuentas	cuenta	cuenta bancaria
Así, el analista <head>adquiere<head> conocimiento sobre la naturaleza del paciente a través de la conciencia de algo que sucede en él. 	adquiere	ganar	adquirir	contraer	requerir	obtener
Se lanzó una subsidiaria en el Reino Unido, Tata Tea (GB) Ltd., que <head>adquirió<head> la participación mayoritaria en Tetley Group. 	adquirió	adquirir	obtener	ganar	contraer	comprar
Con la Oferta ahora completada, 2016091 Ontario Inc. procederá con más pasos para <head>adquirir<head> las acciones restantes de IXOS que no son de su propiedad, de conformidad con la ley alemana. 	adquirir	obtener	ganar	adquirir	contraer	comprar
Los estudiantes de formación docente <head>adquirirán<head> el conocimiento y las habilidades necesarias para aplicar las tecnologías educativas actuales y emergentes tanto como docentes en formación como docentes en ejercicio. 	adquirirán	adquirir	obtener	conseguir	ganar	ilustrar	contraer
Cuántas veces me he encontrado con esas personas varios años después, para descubrir que han <head>adquirido<head> un estilo de vida, un automóvil y una hipoteca para igualar su salario, y que sus ideales iniciales se han desvanecido hasta convertirse en el más confuso de los recuerdos, que ahora descartan. como una fantasía post-adolescente? 	adquirido	adquirir	lograr	contraer	obtener
Luego juzgue si ya tiene estas habilidades de alguna forma o si podría <head>adquirirlas<head> razonablemente antes de jubilarse. 	adquirirlas	adquirir	obtener	ganar	contraer
Gracias por tener a Osiris aquí. Hemos estado involucrados en la investigación de células madre mesenquimales y células madre adultas durante aproximadamente 11 años. Nuestra tecnología salió del laboratorio de Arnie Kaplan y fue <head>adquirida<head> de Case Western en ese momento, y Nos hemos centrado únicamente en esa área desde entonces en varias aplicaciones. 	adquirida	obtener	adquirir	contraer	comprar
ofrece programas de asesoramiento, educación y defensa que ayudan a los residentes del área a <head>adquirir<head> y conservar / mantener viviendas seguras y asequibles. 	adquirir	adquirir	obtener	conseguir	procurar	contraer	comprar
Aquí se presentan más de 200 de las obras más significativas <head>adquiridas<head> por el Museo del Vidrio de Corning durante la década de 1990, para aumentar sus existencias de 35,000 objetos. 	adquiridas	adquirir	obtener	conseguir	contraer	comprar
Sin embargo, los últimos cuatro son inalcanzables, insiste el narrador, si no puedes <head>adquirir<head> la seguridad personal, el núcleo interno, dice Covey, que presumiblemente proviene de un dominio de los cimientos. 	adquirir	adquirir	obtener	contraer
Para involucrar a los vecinos y <head>llamar<head> aún más la atención sobre los árboles, los organizadores ataron enormes cintas rojas alrededor de cada tronco y realizaron un mitin debajo de los árboles donde vendieron camisetas, viseras y refrescos. 	llamar	atraer	traer	aducir	producir	causar	aportar
En resumen, el proceso de sanación del Curso consta de dos pasos básicos: Salir de la falsa negación <head>llevando<head> nuestras ilusiones a la luz de la verdad. 	llevando	traer	entablar	formular	atraer
Responsabilidad civil Cuando una de las partes cree que la otra parte ha dañado la propiedad, los cultivos o los animales por el uso indebido o la aplicación incorrecta de pesticidas, la parte perjudicada puede <head>presentar<head> una demanda civil en busca de una compensación monetaria por el daño. 	presentar	traer	inducir	persuadir	acarrear	convencer	atraer
28.1 La Commission des normes du travail contribuirá al fondo de la Commission des Relations du travail mencionado en la sección 137.62 del Código del Trabajo (capítulo C-27) para sufragar los gastos incurridos por la Comisión en relación con los procedimientos <head>iniciados<head> ante la Comisión. bajo las Divisiones II y III del Capítulo V de esta Ley. 	iniciados	traer	llevar	confrontar
Antes de votar por un piso de reemplazo adecuado, esperamos que la Comisión solicite al solicitante que realice una investigación física en el sitio y / o archivo para que el diseño del nuevo piso se pueda basar en las condiciones históricas y el interior del restaurante se pueda <head>acercar<head> a su apariencia histórica en lugar de estar más lejos. 	acercar	acercar	traer	arreglar	llevar	cambiar	aproximar	atraer
Juega con tu gato o perro, permitiendo que su energía elemental te <head>lleve<head> de vuelta a tierra firme. 	lleve	traer	traer de regreso	traer de vuelta	volver a traer
¡El hecho es que la mejor manera de <head>traer<head> movimiento a tu vida es dejar de & # 39;hacer ejercicio&#39; y comenzar a vivir! 	traer	traer	inducir	dar	aportar
<head>Llevó<head> la unidad a su oficina y nuevamente se comportó igual. 	Llevó	traer	llevar	acarrear	atraer
Ahora que regresa a Main St. en Lincoln, el antiguo sitio maderero de Erb está renaciendo gracias a la visión de Sam y Toby Haberman, comerciantes desde hace mucho tiempo, quienes eventualmente <head>traerán<head> aproximadamente 70,000 pies cuadrados adicionales de espacio comercial y la reubicación de su famosa tienda de telas. 	traerán	traer	conseguir	atraer	aportar
<head>Saliendo<head> de la habitación en un ataque de pasión, rebotaron de una habitación a otra en una serie de enérgicos abrazos, golpeando casi todas las paredes de la casa. 	Saliendo	explotar	estallar	reventar	salir con ganas
No espere que los máximos de los contratos se vuelvan a alcanzar durante mucho tiempo, ya que la burbuja de las materias primas está <head>estallando<head>. 	estallando	estallar	explotar	consumir	desaparecer	reventar
Todavía no ha conseguido una victoria como las de Iban Mayo en el Midi Libre o la Classique des Alpes del año pasado, pero ha <head>irrumpido<head> en escena con una retahíla de resultados notables durante la primera mitad del año. 	irrumpido	irrumpir	aparecer sorpresivamente	entrar con estrepito	aparecer
6) Se acordó además que una iniciativa de la montaña no debería <head>irrumpir repentinamente<head> en el electorado político, sino que debería verse en preparación con mucha antelación, con una dimensión demostrada en la conciencia y la preocupación popular. 	irrumpir repentinamente	estallar	explotar	aparecer	reventar
Una rama, <head>repleta<head> de flores rojas, colgaba sobre la entrada. 	repleta	explotar	estallar	encender	resaltar	renacer	reventar
En segundos, <head>irrumpieron<head> en el espacio pedregoso abierto antes que el muskeg. 	irrumpieron	irrumpir	explotar	aparecer	desplegar	salir con estrepito
Un pequeño número de residentes también tuvo que ser evacuado cuando el río Wharfe se <head>desbordó<head> e inundó la A65 en Ilkley y Otley el viernes por la noche. 	desbordó	estallar	explotar	desbordar	reventar	originar
Y por lo que ha visto, Buckley no está exactamente a punto de <head>reventar<head> para apoyar a la Iglesia de Knoxville oa las Iglesias Internacionales de Cristo. 	reventar	explotar	reventar	apoyar	romper	irrumpir	estallar	fortalecer
Una noche, mientras él y Jan hablaban, los niños <head>irrumpieron<head> en la sala de estar discutiendo sobre algo. 	irrumpieron	entrar violentamente	irrumpir	estallar	entrar con estrepito	explotar
Esta semana <head>llamará<head> a su compañía de dos organizadores de fiestas a tiempo parcial el Circuito de fiestas de baile urbano subterráneo de San Francisco. Sabes, lo que estamos haciendo, no se está haciendo, confiesa el presentador profesional con barba de chivo, En Nueva York, han dejado que los túneles lleguen a las personas sin hogar. 	llamará	llamar	convocar	requerir	juntar	congregar
El artículo citó a Richard C. Darnell, presidente de la Sociedad, diciendo que el Dr. JB Rhine, director del Laboratorio de Parapsicología de la Universidad de Duke, <head>calificó<head> el llamado fantasma como la manifestación más impresionante de la que ha oído hablar en el campo de los poltergeist.. El artículo terminaba con el ministro diciendo que las cosas habían estado tranquilas en la casa durante los últimos dos meses. 	calificó	llamar	nombrar	denominar	conocido como	designar
La noche que vi la obra, sus tres invitados eran Arthur Helton, director de Estudios de Paz y Conflictos del Consejo de Relaciones Exteriores; una solicitante de asilo de Somalia <head>llamada<head> Ayisha; y una mujer serbia de la antigua Yugoslavia que había emigrado a los EE. UU. después de sufrir durante las guerras de los Balcanes. 	llamada	llamar	convocar	denominar	nombrar
lanzó un servicio adicional con Net2Phone que permite a los usuarios acceder a información en Internet <head>llamando<head> a un número 800. 	llamando	telefonear	llamar	llamar por telefono	marcar
Finalmente, alguien <head>llamó<head> a un escuadrón antibombas federal, que llegó más de una hora después del descubrimiento. 	llamó	llamar	telefonear	convocar	contactar	requerir	llamar por telefono
<head>Llamamos<head> al hotel Marriott Marquis. 	Llamamos	llamar	telefonear	hablar por telefono	llamar por telefono
En el texto, las marcas de voz también <head>llamadas<head> comillas o comillas invertidas) marcan el principio y el final del discurso directo : Helen dijo Me voy a casa. 	llamadas	llamar	nombrar	denominar	conocido como	designar
Para más información <head>llame<head> al 1800 620 420. | volver arriba Ayuda práctica y financiera Una enfermedad grave a menudo causa dificultades prácticas y financieras. 	llame	telefonear	llamar	llamar por telefono
Y mira, recientemente fui a Gap en Oxford Street, y parecían tener un departamento completo dedicado a la ropa que no es de calle, incluido algo que <head>llaman<head> Gap Body, que parece ser un traje de baño para adultos en dos partes (arriba y abajo). 	llaman	llamar	nombrar	denominar	mentar	designar
Para obtener más información acerca de las interacciones entre medicamentos, <head>llame<head> a la línea directa de Project Inform. 	llame	llamar	telefonear	hablar por telefono	hacer una llamada telefonica	llamar por telefono
El Fifeshire, bajo el mando del Capitán Arnold, naufragó cuando salía de Nelson el 27 de febrero de 1842 cuando la marea lo <head>llevó<head> a Arrow Reef, que lleva el nombre de un barco que formaba parte de la expedición de reconocimiento. 	llevó	llevar	arrastrar	transportar	traer	acarrear
Además, estas agujas se desafilan rápidamente y pueden desarrollar púas y ganchos que no solo destrozan la piel sino que también <head>llevan<head> microóxido, lo que puede causar infección. 	llevan	portar	llevar consigo	dejar	llevar	traer	producir	acarrear	transmitir
Fuentes del gobierno le dijeron a NBC News que los investigadores federales recientemente pudieron <head>transportar<head> los materiales necesarios para fabricar una bomba casera similar a través de controles de seguridad en 21 aeropuertos. 	transportar	llevar	cargar	acarrear	llevar cargando	transportar	traer
El ALSEP en A-17 <head>transportaba<head> diferentes instrumentos una vez que las redes habían sido establecidas por vuelos anteriores. 	transportaba	llevar	portar	traer	cargar	acarrear	implicar
2 El Dr. Borlaug no puede permitirse el lujo de esperar : hay una causa importante que pesa sobre su mente, algo que debe <head>llevarse<head> a cabo y debe llevarse a cabo ahora. 	llevarse	realizar	llevar acabo	emprender	llevar	sacar
2001 Febrero : Gran Bretaña y EE. UU. <head>realizan<head> bombardeos para intentar desactivar la red de defensa aérea de Irak. 	realizan	llevar acabo	realizar	emprender	ejecutar	transportar	llevar	trasladar
2 En nuestra sociedad cambiante, a muchas personas que cenan en nuestro restaurante les desagrada <head>llevar<head> dinero. 	llevar	llevar consigo	cargar	portar	llevar	transportar
<head>Llevaron<head> consigo sus rollos de la Torá cuidadosamente envueltos. 	Llevaron	llevar	llevar consigo	portar	cargar	traer
En 1889 ganó un gran contrato para suministrar municiones y fundó en 1889 la Rheinische Metallwaaren und Maschinenfabrik con el propósito explícito de <head>llevar<head> a cabo este contrato y establecerse como proveedor militar. 	llevar	llevar acabo	realizar	emprender
Incluso si la información a nivel de artículo sigue siendo genérica, la identificación de artículos que las personas usan o <head>llevan<head> podría asociarlos, por ejemplo, con eventos particulares como mítines políticos. 	llevan	llevar	cargar	llevar consigo	portar	traer consigo
PETER ORSZAG, Brookings Institution : Y brevemente, por ejemplo, sobre las acciones preferentes, al menos según los informes iniciales, los dividendos pagados sobre las acciones preferentes se tratan como ingresos por intereses, y no está <head>claro<head> si estarían exentos o no según esta propuesta. 	claro	claro	obvio	esclarecido	definido
En el camino a seguir, se propuso que Canadá siguiera simultáneamente enfoques incrementales y la abolición total, sobre la base de que el incrementalismo por sí solo no tenía sentido sin un sentido <head>claro<head> del destino final, pero también que era importante no obligar a otros a elegir entre los dos porque esto simplemente perdería a los aliados de Canadá. 	claro	claro	obvio	definido
En este sentido, ninguna tinta parece tener una <head>clara<head> ventaja sobre la otra. 	clara	claro	obvio	evidente	perceptible
Lo que está <head>claro<head> es que deberíamos considerar que una empresa como Microsoft podría ejercer el mismo tipo de poder que la Fundación. 	claro	claro	entendido	incuestionable	comprendido	obvio
Después de abrir algunos archivos en el proyecto de muestra, el concepto de proyectos y uso de archivos es <head>claro<head>. 	claro	claro	entendido	esclarecido	comprendido	obvio
La brisa <head>clara<head> y fresca está en su cara a primera hora de la mañana, y los niños tienen nueva energía e interés en la temporada. 	clara	claro	limpio	puro	limpido	transparente	diafano	cristalino
La reacción de uno de ellos fue <head>clara<head> : & # 39;yappari, towel desu&#39; (Otra vez una toalla). 	clara	claro	obvio	esclarecido	perceptible	preciso
Los iraquíes estaban sentados en el suelo del desierto en grupos de tres o cuatro; estaba <head>claro<head> que estaban cansados, tenían frío y hambre. 	claro	claro	obvio	evidente	perceptible
Dejé ese punto perfectamente <head>claro<head> para aquellos de ustedes con quienes lo discutí el jueves. 	claro	claro	evidente	obvio	sin lugar a duda	consiso	preciso
Lo he golpeado un par de veces y nunca se rompe ni se rompe. si pudieras darnos alguna idea, las fotos no son las mejores, pero espero que sean lo suficientemente <head>claras<head> para darte una idea de lo que es. 	claras	claro	esclarecido	iluminado	brillante	sin distorcion
Para entender por qué esto debería haber sido así, debemos observar más de <head>cerca<head> la naturaleza del estilo y sus orígenes. 	cerca	de cerca	detenidamente	con detenimiento	cerca	en detalle	cercanamente
Algunas personas han adivinado que esta radiación está <head>estrechamente<head> relacionada con un período de frío intenso y un alto nivel de capa de hielo que se produjo alrededor de 600 millones de años; tal vez las tensiones ambientales eliminaron a los competidores y crearon oportunidades para que un animal (relativamente) inteligente tuviera éxito y proliferara. 	estrechamente	cerca	fuertemente	estrechamente	de cerca	intimamente
Están trabajando <head>de cerca<head> con el Parque Estatal Natural Tunnel, donde el personal, deseoso de tener viviendas adicionales cerce, les ha asegurado a los Baker que se reservarán regularmente ya que la demanda de viviendas supera la oferta. 	de cerca	de cerca	cerca	proximo	cercanamente	hombro con hombro	en estrecha relacion
El Departamento también está trabajando <head>en estrecha colaboración<head> con HM Customs and Excise, que están a la cabeza en el desarrollo del plan nacional de cobros a los usuarios de las carreteras de camiones. 	en estrecha colaboración	cercanamente	de cerca	en conjunto con	proximo	estrechamente	hombro con hombro	en estrecha relacion
MINORISTA : En los EE. UU., los analistas observarán de <head>cerca<head> los resultados del tercer trimestre. 	cerca	cercanamente	de cerca	con detenimiento	cerca	en detalle	estrechamente
Sus carreras académicas están <head>estrechamente<head> entrelazadas con desarrollos sociales y políticos como la secularización y el antisemitismo. 	estrechamente	estrechamente	proximo	cerrado	intimamente
“ El bebé se ha desarrollado con mucha normalidad y ha sido seguido de <head>cerca<head>. 	cerca	de cerca	cerca	en detalle	cercanamente	detenidamente	con detenimiento
Para prevenir los episodios de asma, deberá trabajar <head>en estrecha colaboración<head> con su médico para : Desarrollar un plan de medicamentos que evite que tenga síntomas. 	en estrecha colaboración	de cerca	cerca	cercanamente	estrechamente	inmediatamente	en estrecha relacion
Los problemas se marcan rápidamente y, <head>en estrecha colaboración<head> con su personal, proponemos soluciones. 	en estrecha colaboración	cercanamente	de cerca	cerca	estrechamente	hombro con hombro	inmediatamente	en estrecha relacion
La <head>dejé<head> hace seis horas, dice el joven monje. 	dejé	dejar	renunciar	rechazar	llevar	quitar	aventar
En cambio, <head>dejó<head> caer al hombre al suelo a sus pies. 	dejó	arrojar	lanzar	soltar	hacer caer	dejar	derribar	dejar caer	aventar
7) Verdadero o falso : el censo de EE. UU. de 2000 <head>eliminará<head> la pregunta sobre el estado civil en el formulario universal. 	eliminará	dejar de lado	dejar	sacar	dar de baja	abandonar	lanzar	abrir	eliminar	dar a conocer	liberar
Tal acuerdo establece que la autoridad local comenzará a hacer una contribución financiera para cubrir los costos una vez que los ahorros de la persona <head>caigan<head> por debajo de cierta cantidad. 	caigan	caer	descender	bajar	superar	traspasar	pasar
La economía se expandió en más del 10 por ciento, el número de personas con trabajo aumentó en un 5 por ciento y la tasa de desempleo <head>cayó<head> por debajo del 4 por ciento por primera vez. 	cayó	caer	descender	bajar	decrecer	rebasar
Estoy especialmente sorprendido de ver <head>caer<head> a Le Nain, no es que alguna vez haya sido tan fanático de él o de sus hermanos, pero habría pensado que, a la luz de los aspectos de la revisión, usar el arte como una forma de discutir raza, clase, y género - hubiera sido útil. 	caer	dejar	dar de baja	caer	abandonar
Reichen / Chip, que tienen mucho tiempo para matar (como 9 horas), deciden hacer su movimiento característico de <head>echar<head> anclas y pegarse al suelo con cemento para mantener un lugar en la fila. 	echar	dejar caer	tirar	arrojar	lanzar	soltar	dejar	bajar
A los gerentes les gusta creer que el sindicato no está realmente tan interesado en perseguir la mayoría de las quejas y <head>dejará<head> la mayoría de ellas en algún lugar del camino. 	dejará	tirar	soltar	dejar	dejar caer	dar de baja	botar	disminuir	eliminar
Además de hacer y mantener el nido de burbujas, reemplazar los huevos que pueden <head>caer<head> del nido, reunir a las crías rezagadas y morder a las crías a intervalos, él está constantemente alerta para proteger los huevos y las crías de los intrusos que pueden devorarlos.. 	caer	caer	rodar	descender	lanzar
LA FAMILIA HISPANA : UN RECURSO SIN EXPLORAR Un paso que las escuelas pueden tomar es comprender y aprovechar una fuente de fortaleza importante y subutilizada : la familia <head>extendida<head> hispana. 	extendida	extenso	familia y parientes	politico	extendido	amplio
) y grabando una prueba de sonido <head>extendida<head> en una pequeña máquina de cinta que puede terminar jugando un papel importante en nuestro próximo disco. 	extendida	extenso	amplio	vasto	extendido	largo
Discusión TOP En este estudio, hemos demostrado que la gp120 recombinante aumenta la permeabilidad de los cultivos de endotelio cerebral a la albúmina, muy probablemente al alterar la morfología celular e inducir espacios intercelulares <head>extendidos<head> que permiten el paso de macromoléculas y probablemente facilitan la transmigración celular a través de la BBB. 	extendidos	extenso	extendido	largo	alargado	de gran extension	dilatado	amplio	grande
Familia nuclear Esta unidad observa y evalúa la eficacia del cuidado de los niños en el entorno del hogar de la familia nuclear, analizando la experiencia de los niños con sus padres y la familia <head>ampliada<head>. 	ampliada	extenso	familia y parientes	politico	grande	largo	amplio
EN EL TRABAJO : reportarse enfermo, llegar tarde, irse temprano, tomar descansos <head>prolongados<head>, renunciar a su territorio (¿Por qué no dejas que Mary se encargue de esa tarea por ti?). 	prolongados	largo	extenso	amplio	extendido	de gran extension	grande	prolongado
(Grieve 1927a, 19) [ 9 ] Por lo tanto, este libro marcó el comienzo de lo que iba a ser una batalla <head>prolongada<head> entre MacDiarmid, así como los otros fundamentalistas celtas del NPS, y los nacionalistas conservadores del Partido Escocés. 	prolongada	extenso	largo	amplio	extendido	prolongado
No es sorprendente que Ellison dedique una cantidad considerable de tiempo a describir los resultados de su propio trabajo de campo <head>extenso<head> entre cazadores-recolectores de Efe y horticultores leseses que viven en las selvas tropicales de la República Democrática del Congo. 	extenso	extenso	amplio	extendido	largo	grande	prolongado	de gran amplitud
Las garantías <head>extendidas<head> para computadoras de escritorio tienden a ser una estafa, porque normalmente pagaría a un técnico independiente mucho menos en costos de reparación durante el mismo período que los costos de una garantía extendida típica para proporcionar cobertura de reparación. 	extendidas	extendido	prolongado	largo	extenso	amplio
Siempre he estado un poco con los cabos sueltos cada vez que me dan un período <head>prolongado<head> de tiempo libre. 	prolongado	extendido	largo	extenso	prolongado	alargado	amplio
Estaba tomando un medicamento recetado durante un período <head>prolongado<head> bajo la supervisión de un médico que se especializa en el control del dolor. 	prolongado	amplio	largo	extenso	extendido	interminable	prolongado
Los valores negativos indican el Oeste del primer meridiano. actualización <head>Campo<head> de texto de 8 caracteres que consiste en dígitos numéricos. 	Campo	campo	espacio	dominio	area de accion
Una estrecha coordinación con los foros de la CEPT apoyaría el surgimiento de soluciones paneuropeas en <head>campos<head> como las frecuencias y la numeración (ver la siguiente sección) permitiendo una cobertura de los 43 países europeos miembros de la CEPT. 	campos	campo	area	dominio
Esta comunidad es una de las que comparten el <head>campo<head> petrolero Yorla operado por Shell Petroleum Development Company (SPDC). 	campo	campo	area de actividad	campo de accion
Los estudiantes aprendieron sobre el empleo y las oportunidades en los <head>campos<head> de la ciencia y la tecnología y adquirieron una comprensión de las realidades de las responsabilidades en el lugar de trabajo. 	campos	campo	area	dominio
<head>Campos<head> receptivos, interacción binocular y arquitectura funcional en la corteza visual del gato. 	Campos	campo	area	dominio
La precisión decimal, a su vez, determinará la cantidad de espacio en disco que se asigna a los datos almacenados en ese <head>campo<head>. 	campo	campo	area	espacio	dominio
¡Algunos de los barcos de pesca actuales son más largos que un <head>campo<head> de fútbol! 	campo	campo	cancha	prado
Mientras estos oficiales están completando esta enorme tarea, la aplicación efectiva de la ley en el <head>campo<head> sufrirá. 	campo	campo	area de actividades	area	campo de accion
Todas estas disposiciones del Acuerdo sobre los ADPIC deben integrarse adecuadamente en el marco de la OMPI. Asistencia técnica La OMPI es el principal proveedor multilateral de asistencia técnica en el <head>campo<head> de la propiedad intelectual. 	campo	campo	area	dominio
Con el fin de evaluar la naturaleza del tsunami que golpeó este tramo aislado de la costa y determinar la causa de las grandes olas, la comunidad internacional de tsunamis realizó un estudio de <head>campo<head> del área. 	campo	de campo	campo	investigacion de campo
