For more information <head>call<head> 1800 620 420. | back to top Practical and financial help A serious illness often causes practical and financial difficulties.	call	call	phone	ring	telephone
And lo, I recently went into Gap in Oxford Street, and they seemed to have an entire department devoted to non-street wear, including something they <head>call<head> Gap Body, which seems to be an adult romper suit in two parts (top and bottom).	call	call	name	refer to as	term	label	designate	entitle	dub
For more information about drug interactions, <head>call<head> Project Inform's hotline.	call	call	contact	phone	ring	telephone
Wherever the AZT <head>caravan<head> stopped, it presented physicians from important metropolitan centres like London and New York.	caravan	company	caravan	vehicle	roadshow	trailer	cavalcade
Your trailer or <head>caravan<head> must be fitted with an approved style number plate.	caravan	house trailer	mobile home	caravan	camper
If you sat facing Cologne you couldn't see the chimney stacks further up the river, if you squinted you couldn't see the <head>caravan<head> park on the other side, if you drank enough weisse weijn the thronging day-trippers greyed-themselves out.	caravan	caravan	mobile home	camper
Tent, <head>caravan<head> or campervan. ��� Make sure of your future work plans before you move on from your present location.	caravan	trailer	house trailer	mobile home	caravan	camper
You might think of several <head>caravans<head> of trucks all using the same road system to carry materials.	caravans	group	caravan	convoy	cavalcade
The town is also well known as a transit point for the camel <head>caravans<head> bringing salt up from the arid lands of the Dankal Depression.	caravans	traveller	train	company	party	caravan	convoy	cavalcade
In his distress of mind at being left behind by the <head>caravan<head>, he had not noticed where he had thrown the load.	caravan	company	caravan	trailer	mobile home	convoy
About the time that Ross, Trudo, and Benware were beating Tipton senseless, the three-vehicle <head>caravan<head>, led by the Blazer, with defendant as the driver and Harris as a passenger, pulled into the parking lot.	caravan	company	caravan	convoy	camper	cavalcade	crocodile
Lazy Lizard Caravan Park, Pine Creek Small and nondescript <head>caravan<head> park behind the Pine Creek Tavern, off the Stuart Highway.	caravan	trailer	caravan	mobile home
Directly away from where the <head>caravan<head> was headed.::: Yang watched the exchange with interest.	caravan	caravan	company	trailer	mobile home	convoy	cavalcade	convey
The Fifeshire under the command of under Captain Arnold was wrecked while leaving Nelson on 27 February 1842 when the tide <head>carried<head> her onto Arrow Reef named after a vessel that was part of the survey expedition.	carried	carry	bring	send	drag	bear	convey
Beside which, these needles dull quickly, and can develop barbs and hooks which not only mangle the skin but <head>carry<head> microrust, which can cause infection.	carry	carry	contain	transmit	bear	transport	convey
Government sources tell NBC News that federal investigators recently were able to <head>carry<head> materials needed to make a similar homemade bomb through security screening at 21 airports.	carry	carry	bring	take	transport	bear	convey
The ALSEP on A-17 <head>carried<head> different instruments once the networks had been established by earlier flights.	carried	use	carry	hold	contain	bear	be fitted with	convey
" 2 Dr. Borlaug cannot afford to wait: there is an important cause weighing on his mind, something that must be <head>carried<head> out and must be carried out now.	carried	do	complete	carry	accomplish	execute
2001 February - Britain, US <head>carry<head> out bombing raids to try to disable Iraq's air defence network.	carry	carry	complete	perform	execute	undertake	deploy
2 " In our changing society, many people who dine in our restaurant dislike <head>carrying<head> money.	carrying	bring	carry	take	have on them	hold	pack	convey
They <head>carried<head> with them their carefully wrapped Torah scrolls.	carried	take	carry	bring	transport
In 1889 he won a huge contract to supply ammunition and founded in 1889 the " Rheinische Metallwaaren und Maschinenfabrik " with the explicit purpose to <head>carry<head> out this contract and establish himself as a military supplier.	carry	complete	carry	execute	conclude	undertake	fulfil
Even if item-level information remains generic, identifying items people wear or <head>carry<head> could associate them with, for example, particular events like political rallies.	carry	carry	hold	transport	clutch	lug
PETER ORSZAG, Brookings Institution: And just briefly, for example, on preferred stock, at least according to initial reports, dividends paid on preferred stock are treated as interest income, and it's not <head>clear<head> whether they would be exempted or not under this proposal.	clear	clear	certain	evident	apparent	transparent
On the way ahead, it was proposed that Canada simultaneously pursue incremental approaches and outright abolition, on the grounds that incrementalism on its own was pointless without a <head>clear<head> sense of the final destination, but also that it was important not to force others to choose between the two because this would simply lose Canada allies.	clear	clear	true	definite	obvious	distinct	unambiguous
In this regard, neither ink appears to have a <head>clear<head> advantage over the other.	clear	clear	obvious	distinct	unambiguous
What is <head>clear<head> is that we should consider a company like Microsoft to potentially be able to wield the same kind of power as the Foundation.	clear	clear	certain	obvious	evident	plain	distinct
After opening a few files in the sample project the concept of projects and file usage is <head>clear<head>.	clear	clear	evident	obvious	plain	unmistakable	apparent
The <head>clear<head> cool breeze is on your face first thing in the morning, and the children have new energy and interest in the season.	clear	fresh	clean	pure	clear
The reaction from one of them was <head>clear<head>: &#8216;yappari, towel desu'(Again a towel).	clear	clear	obvious	plain	unmistakable	lucid
The Iraqis were sitting on the desert floor in groups of three or four; it was <head>clear<head> that they were tired, cold, and hungry.	clear	clear	obvious	plain	patent
I made that point perfectly <head>clear<head> to those of you who I discussed that with on Thursday.	clear	clear	obvious	understandable	evident	distinctly	unambiguous
I 've bumped it a few times and it never rips or breaks. if you could give us some idea, the pics aren't the greatest, but I 'm hoping they are <head>clear<head> enough to give you some kind of idea what he is.	clear	clear	sharp	distinct	unblurred	unobscured
Well, she finally deigned to bring my basin, and even though I swear I didn't plan it, I projectiled all over the front of her as soon as she got <head>close<head> to my bed.	close	close	near	adjacent
The control of government spending has improved, tax rates have stayed <head>close<head> to the low levels set in the early 1980s, regulatory pressure has eased, and monetary policy has been superb and steady.	close	close	near	about	proximate
The application was opposed by a substantial number of residents living <head>close<head> to the property.	close	close	near	local	neighbouring
Quite the biter, don't get your fingers too <head>close<head>.	close	close	near
M����riel, always the planner, added, " Yes--if we get get <head>close<head> enough and you can inflict enough damage on it to prevent it from flying, then just keep pounding on it!	close	close	near
Provided that the humps or ramps are spaced sufficiently <head>close<head> together, an 85 percentile speed of less than 30kph is achievable.	close	close	near	adjacent	proximate	contiguous
The sitting Liberal MP is John Day, a former Dentist who first won this seat in 1993, served as Health Minister in the second term of the Court government, and came <head>close<head> to losing his seat in 2001.	close	close	near	almost
Note Some of the perches are new and are positioned <head>close<head> to the original perches.	close	close	near
Major smog occurrences are often linked to heavy motor vehicle traffic, sunshine, high temperatures and calm winds or temperature inversion (weather condition in which warm air is trapped <head>close<head> to the ground instead of rising).	close	close	near	next
By not slowing down at the end, I at least come <head>close<head> to making back the lost time.	close	close	near
To understand why this should have been so, we need to look more <head>closely<head> at the nature of the style and its origins.	closely	carefully	closely	in detail	attentively	intently	scrupulously
Some people have guessed that this radiation is <head>closely<head> related to a period of intense cold and a high level of ice cover occurring around 600 mya; perhaps environmental stresses wiped out competitors and created opportunities for a (relatively) clever animal to succeed and proliferate.	closely	directly	strongly	nearly	intimately
They are working <head>closely<head> with Natural Tunnel State Park, where the staff, eager to have additional housing nearby, have assured the Bakers that they will be booked on a regular basis since the demand for housing outweighs supply.	closely	together	closely	collectively	jointly	intimately	in concert	in unison
The Department is also working <head>closely<head> with HM Customs and Excise who are in the lead on developing the national Lorry road user charging scheme.	closely	together	collectively	jointly	in unison	intimately	in concert
RETAIL: In the U.S., analysts will be looking <head>closely<head> at third-quarter results.	closely	in detail	carefully	closely	attentively	intently
Their academic careers are <head>closely<head> intertwined with social and political developments such as secularisation and antisemitism.	closely	closely	strongly	intimately	neatly
" The baby has developed very normally and has been followed <head>closely<head>.	closely	carefully	closely	attentively	in detail
To prevent asthma episodes you will have to work <head>closely<head> with your doctor to: Develop a medicine plan that keeps you from getting symptoms.	closely	together	closely	alongside	jointly	in concert	in unison	in tandem
Problems are flagged quickly and, working <head>closely<head> with your staff, we propose solutions.	closely	together	closely	carefully	jointly	in unison	in concert	intimately	in tandem
WHAT WOMEN WANT ON A FIRST DATE (Updated Thursday, Dec 5, 2002, 02:06:55 PM to reflect the 100 most recent valid responses.) Assuming you are a woman, which most <head>closely<head> matches your idea of a great first date?	closely	closely	approximately	nearly
But that last statistic is misleading, because a variety of studies shows that about 40 % of the workers who don't take up healthcare offers have coverage through a spouse, and another 20 % (likely younger workers) <head>decline<head> coverage to save money.	decline	refuse	reject	decline	forgo
In an interview for this survey, Gordon Brown, the British chancellor and himself a Scotsman, said that support for the SNP <head>declined<head> as the election neared because the party failed to give convincing answers to big questions about how it would run Scotland's economy.	declined	drop	fall	decrease	decline	reject	lessen
St. Lawrence Cement increased domestic cement deliveries, but on balance volumes <head>declined<head> owing to delivery bottlenecks in the northeastern US.	declined	drop	fall	decrease	decline
The Air Force has experienced low levels of equipment availability in the last five years, and availability of the Hercules and the Aurora fleets continues to <head>decline<head>.	decline	fall	drop	decrease	decline	deteriorate
High school non-completion rates continue to <head>decline<head> 5 and an increasing number of young people are pursuing post-secondary education 6.	decline	drop	fall	decrease	decline	deteriorate
Whenever there is a condition with results in cardiac dysfunction stroke volume will eventually <head>declined<head>.	declined	drop	fall	decrease	decline
The productivity of crops and pastures, as well as the health of other vegetation, <head>declines<head> as the saline watertable reaches their root zones.	declines	get worse	fall	drop	decrease	decline
Unhappy with being called to task for <head>declining<head> scores, political educators complained that the tests were unfair to some, so they watered them down - - as if 2+2=4 was being challenged as unfair on racial, gender or other social-oriented measures.	declining	fall	decrease	decline	deteriorate
In particular, per capita incomes in Africa have <head>declined<head> relative to the industrial countries and in some countries have declined in absolute terms.	declined	drop	fall	decrease	decline
The GARCH model is an infinite order ARCH model with a geometrically <head>declining<head> set of weights.	declining	reduce	decrease	decline
" " I <head>dropped<head> her off six hours ago, " the young monk says.	dropped	drop	leave	set down	left round	unload	deliver
Anyway, I saw your ad on the net and just wanted to <head>drop<head> you a line to say hello.	drop	write	send	email	text	drop	send a letter	send a message	write a letter
Instead, she <head>dropped<head> the man to the ground at her feet.	dropped	throw	drop	dump	let go of	let fall	relinquish
7) True or False: The 2000 U. S. Census will <head>drop<head> the question on marital status on the universal form.	drop	leave out	drop	abandon	omit	ditch
Such an agreement states that the local authority will start to make a financial contribution towards costs once the person's savings <head>drop<head> to below a certain amount.	drop	fall	drop	decline
The economy expanded by over 10 per cent, the number of people at work increased by 5 per cent and the unemployment rate <head>dropped<head> below 4 per cent for the first time.	dropped	drop	fall	decline
I 'm especially surprised to see Le Nain <head>dropped<head> - not that I ever was such a fan or him or his brothers, but I would have thought that in light of aspects of the revision - using art " as a way to discuss race, class, and gender " - he would have been useful.	dropped	leave out	drop	abandon	deselect
Reichen/Chip having plenty of time to kill (like 9hrs) decide to do their signature move of <head>dropping<head> anchors and cementing themselves to the floor to keep a spot in line.	dropping	drop	stop	lower	pause	weigh
Managers like to believe that the union isn't really all that keen on pursuing most grievances and will <head>drop<head> most of them somewhere along the way.	drop	leave	drop	abandon	terminate	discontinue	relinquish
In addition to making and maintaining the bubble nest, replacing eggs that may <head>drop<head> from the nest, rounding up the straggling young, and mouthing the young at intervals, he is constantly on the alert to protect the eggs and young from intruders that may devour them.	drop	fall	drop
If they are looking for an <head>easier<head> language than C++, C# should have been their option, but I would even prefer C++ to Java.	easier	easy	simple	accessible
Just fill out <head>easy<head> form to enter, no other restrictions listed.	easy	simple	easy	uncomplicated	undemanding
I 've never been <head>easier<head> for callers to reach, or had greater freedom with less hassle while being assured of getting all important calls and messages.	easier	easy	simple	convenient	more accessible	trouble free	less difficult	more straightforward
Remember that the delegates���� life is not always <head>easy<head>.	easy	easy	simple	straightforward	uncomplicated	trouble free	undemanding
In particular, the fact that it is quite <head>easy<head> for media students to be reasonably slick media producers in the online environment, means that we are all more actively engaged with questions of creation, distribution and audience.	easy	easy	simple	possible	straightforward	undemanding
The Guardian uses the example that it's <head>easier<head> to create UK maps using the American Google Maps than our own Ordnance Survey.	easier	easy	simple	not difficult	more straightforward	less
Apache is designed as a set of modules, enabling administrators to choose which features they wish to use and making it <head>easy<head> to add features to meet specific needs inlcuding handling protocols other than the web-standard HTTP.	easy	easy	possible	simple	straightforward
The basics are very well expressed and <head>easy<head> to understand.	easy	easy	simple	not difficult	straightforward
By Rick Warren There are so many books and tapes on goal setting and establishing objectives that it���s <head>easy<head> to get bored with them.	easy	easy	not difficult	possible	common
I will not <head>endure<head> the laughter of the Court.	endure	tolerate	put up with	suffer	endure
And this combined annual incidence-rate will <head>endure<head> indefinitely too, until the annual production-rate is altered.	endure	last	continue	endure
Positive attitude overcomes pelvic pain Former athlete Janet H has <head>endured<head> 20 operations and has been reduced to surviving on a special liquid diet after being stricken 24 years ago with endometriosis.	endured	have	go through	undergo	suffer	experience	endure
What wasn't my fault was the ordeal I had to <head>endure<head> to fix it.	endure	go through	suffer	tolerate	undergo	endure
Developers are routinely asked to <head>endure<head> the hardships of design extremes, such as a low-memory footprint, in order to reduce total system cost.	endure	put up with	tolerate	bear	suffer	undergo	submit to	endure
The White Sox, who are <head>enduring<head> what I call the Curse of the 1919 Black Sox?	enduring	suffer	have	undergo	endure
And, to a large extent I have Harvard to thank for that��for the extraordinary role models I studied and studied under and the friendships I made that have <head>endured<head>.	endured	last	continue	endure	persist
Now here he is, gowned and on a gurney, forced to <head>endure<head> a medical procedure all because of some soup.	endure	go through	put up with	undergo	endure
However, people often <head>endured<head> inadequate AT because of the lack of a viable alternative.	endured	put up with	suffer	experience	endure
The campaign should challenge the notion that prostate problems are an inevitable part of ageing to be <head>endured<head> rather than investigated.	endured	put up with	suffer	tolerate	bear	endure
THE HISPANIC FAMILY: AN UNTAPPED RESOURCE One step that schools can take is to understand and tap into an important and underutilized source of strength--the Hispanic <head>extended<head> family.	extended	extended	expanded	additional	broad
) and recording an <head>extended<head> soundcheck on a little tape machine that may end up playing a big role on our next record.	extended	long	extended	prolonged	lengthened	protracted
Discussion TOP In this study, we have shown that recombinant gp120 increases the permeability of brain endothelium cultures to albumin, most likely by altering the cell morphology and inducing <head>extended<head> intercellular gaps that allow passage of macromolecules and probably facilitate cell transmigration across the BBB.	extended	long	increased	extended	lengthened	elongated
Nuclear Family This unit observes and assesses the effectiveness of childcare in the nuclear family home environment, looking at the childrens ' experience with their parents and <head>extended<head> family.	extended	extended	wide	expanded	broad	additional
AT WORK: calling in sick, coming in late, leaving early, taking <head>extended<head> breaks, giving up your territory (" Why don't you let Mary take over that assignment for you ").	extended	long	extended	lengthy	prolonged	lengthened	protracted
(Grieve 1927a, 19) [9] This book therefore marked the beginning of what was to be an <head>extended<head> battle between MacDiarmid, as well as the other Celticist fundamentalists in the NPS, and the conservative nationalists of the Scottish Party.	extended	long	extended	lengthy	drawn out	prolonged	protracted
Not surprisingly, Ellison spends a considerable amount of time describing the results of his own <head>extended<head> fieldwork among Efe hunter-gatherers and Lese horticulturalists living in the rainforests of the Democratic Republic of Congo.	extended	lengthy	extensive	extended	comprehensive	expansive	prolonged
<head>Extended<head> warranties for desktop computers tend to be rip-offs, because you would usually pay an independent technician much less in repair costs over the same period that a typical extended warranty costs to provide repair cover.	Extended	long	additional	extended	increased	lengthened	expanded	augmented
I���ve always been kind of at loose ends whenever I���m given an <head>extended<head> period of free time.	extended	long	extended	lengthy	prolonged	protracted
I was taking a prescription medication over an <head>extended<head> length of time under the supervision of a physician who specializes in the management of pain.	extended	long	extended	lengthy	prolonged	protracted
This <head>external<head> communication could be with external trading partners or within the organization.	external	outside	external
That is, we can be glad so long as we do not believe in <head>external<head> authority (for example, the testimony of others) alone for our religious beliefs.	external	external	outside
The <head>external<head> appearance of each type of extinguisher maybe different and each carries its own instructions for use.	external	outer	outside	outward
<head>EXTERNAL<head> RESOURCES: Assess external resources and the community's institutional, political, technical, legal and fiscal capability to engage in hazard mitigation and response.	EXTERNAL	external	outside	nonlocal
Q Can you kindly advise if Team Roles change with different team members and <head>external<head> factors e.g. company setting, cultural context?	external	external	outside
<head>External<head> links to other Internet sites should not be construed as an endorsement of the views or privacy policies contained therein.	External	outside	external	link
When careful measurements are taken of current flows in the generator and in the <head>external<head> circuit, evidence suggests that electric charges are appearing at the periphery of the generator and disappearing at the center of the generator that do not actually pass through the generator.	external	outside	external	outer	exterior
Many spiritual traditions still eschew technological techniques in favor of more " authentic " ones; so unassisted meditation is said to be better than use of mind machines, electronic biofeedback, or psychotropic chemicals, and the use of technology as a sign of attachment to " worldly " things or reliance on <head>external<head> crutches rather than " self-realization.	external	outside	outer	exterior
" Nothing came to our attention indicating evidence of influence or pressure from internal or <head>external<head> sources, " he wrote.	external	external	outside	exterior
Negative values indicate West of the prime meridian. pdate 8 character text <head>field<head> consisting of numeric digits.	field	area	section	box	field	data item
Close co-ordination with the CEPT fora would support the emergence of pan-European solutions in <head>fields<head> such as frequencies and numbering (see the following section) allowing a coverage of the 43 European member countries of the CEPT.	fields	area	field	activity	speciality	discipline
This community is one of those that share the Yorla oil <head>field<head> operated by Shell Petroleum Development Company (SPDC).	field	area	land	field	resource	licence	acreage
Students learned about employment and opportunities in the <head>fields<head> of science and technology and gained an understanding of the realities of workplace responsibilities.	fields	area	field	domain	speciality	discipline
Receptive <head>fields<head>, binocular interaction and functional architecture in the cat's visual cortex.	fields	field of vision	area	field	region	sphere
Decimal precision will, in turn, determine the amount of disk space that is allocated to the data stored in that <head>field<head>.	field	box	field	area	holder	data item	sphere
Some of today's fishing " boats " are longer than a football <head>field<head>!	field	field	pitch
While these officers are completing this enormous task, effective law enforcement in the <head>field<head> will suffer.	field	area	community	field	area of operation	battleground
����All of these provisions of the TRIPS Agreement should be adequately brought into WIPO����s framework.���� Technical assistance WIPO is the main multilateral provider of technical assistance in the <head>field<head> of intellectual property.	field	area	field	domain	sphere	discipline	province
In order to assess the nature of the tsunami that struck this isolated stretch of coast, and to determine the cause of the large waves, the international tsunami community conducted a <head>field<head> survey of the area.	field	field	investigative	subject	environment
He talked knowledgeably about the braille overlays for the control buttons and genuinely understood the accessibility problems inherent in the <head>flat<head> cooking surfaces.	flat	flat	smooth	horizontal	level
Keep upright posture: keep chest up and out, head tilted slightly upwards, and maintain a <head>flat<head> back.	flat	straight	flat
The molten glass literally floats on the tin, spreading and seeking a controlled level in the same manner as water poured onto a smooth, <head>flat<head> surface.	flat	flat	horizontal	level
The spin's are <head>flat<head>.	flat	flat	horizontal	lifeless	flush	deflated
