For example in 1794 a man called Isaac Rooke was found <head>apparently<head> dead in a close near Nottingham.	apparently	looking	apparently	seemingly	supposedly
Moreover, play seems not only inefficient because of its vigor; it seems to be sometimes downright dangerous, exposing the organism to <head>apparently<head> unnecessary risks.	apparently	clearly	obviously	seemingly	plainly
However, this <head>apparently<head> crushing blow early in a promising career took a strange twist.	apparently	apparently	supposedly	ostensibly
The rest of the world is <head>apparently<head> not doing too differently or even better, whatever the latter may mean in consequence.	apparently	apparently	seemingly	palpably
The chilling conclusion is that <head>apparently<head> fairly modest changes in initial conditions can produce huge differences in the final outcome.	apparently	apparently	seemingly	evidently	ostensibly
" The system <head>apparently<head> requires nothing more than an Internet connection and a Web browser to use -- no software or hardware required.	apparently	apparently	evidently	seemingly	supposedly
The world has been <head>apparently<head> powerless to do anything about it.	apparently	clearly	obviously	evidently	apparently	seemingly	manifestly
In those twenty years, the National Highway Traffic Safety Administration has <head>apparently<head> never deemed the location of the Malibu's fuel system to be a problem.	apparently	evidently	apparently	seemingly	manifestly
<head>Apparently<head> you had to write in to the show requesting tickets at least 9 months in advance.	Apparently	it seems	apparently	seemingly	evidently
As well as this, Newton was no longer <head>around<head> to tear strips off anyone who dared to disagree.	around	there	here	around	alive	living	about	in the vicinity
No, but will he be in a year or two... probably and he most likely wouldn't have been <head>around<head> in two years.	around	here	there	around	about	living	in the vicinity
Bolt the mount on and then secure the whole thing with a small zip tie through one of the original holes at the bottom of the map holder and <head>around<head> the mount.	around	round	around	over	about	surrounding	encircling
A: Me and if I am not <head>around<head>, Marcus.	around	there	here	around	about	in the vicinity
For the last bit of the ramp it wraps <head>around<head> and starts again from T=0.	around	around	over	about	back on itself
The strength of its radiation increases with altitude, as does its boundaries, until it completely merges with the inner belt proper at <head>around<head> 600 miles from the surface of the Earth.	around	around	about	close to	roughly
This will be a Halloween he will never forget!�� And with that they returned to kicking the ball <head>around<head>.	around	here and there	around	about
It��s tasty and a great deal at <head>around<head> ten bucks.	around	about	approximately	close to	roughly
I think that Maya Angelou's words will be very inspiring to readers all <head>around<head>.	around	over	everywhere	all over	through out the world
Been <head>around<head> longer than some of my kids.	around	here	around	about	alive	living	in the vicinity
I mean, if you just let it run wild, people will walk <head>away<head> with a negative impression.	away	away	go	off	depart	head off
The following day she was out there on the steps screaming and yelling, " They 're taking our land <head>away<head> from us.	away	away	stealing	off	and removing it	removing	seizing	confiscate
They just go ahead and puff <head>away<head>.	away	away	continuously	along	with impunity
Less any deductible expenses that they paid in the quarter, and any deductible expenses that were paid <head>away<head> in the quarter at their direction by another person.	away	off	away	out	continuously
" Instead of pushing <head>away<head>, there were movements of acceptance.	away	away	off	distancing themselves	repel	rebuff
If two planes are on a collision course, they are directed <head>away<head> from each other.	away	away	apart	aside	afar
The majority of home and apartment burglaries occur during the daytime when most people are <head>away<head> at work or school.	away	away	out	gone	absent
Keep it at least 6 inches <head>away<head> from the trunk.	away	away	distant	distance
Your expiration date will change if the current expiration date is more than 35 days <head>away<head>.	away	away	off	distant	hence
When we arrived we saw some of our colleagues up on the bar counter boogying <head>away<head> - so of course we got up there and joined in the fun.	away	away	repeatedly	continuously	along
It does this by averaging the red, green, and <head>blue<head> colours around each pixel position.	blue	blue	sapphire
I hope you guys haven't thought I 've been feeling <head>blue<head> this whole week, after last week's appointment.	blue	sad	unhappy	down	depressed	blue	melancholy
But when Daniel turned <head>blue<head> one time and he totally stopped breathing.	blue	grey	blue	pale grey
The common image of the sky is that of a <head>blue<head> dome enclosing us and touching the earth at the horizon.	blue	blue	azure	sapphire
As Lynn Bartels reviews in an excellent article for the January 22 Rocky Mountain News, State Senator Jennifer Veiga, a Democrat from Denver, has introduced Senate Bill 77 to repeal a section of the <head>blue<head> laws that prohibits the sale of most alcohol on Sundays.	blue	conservative	blue	pn
Do they use research, brainstorming, linguistics, databases, software, <head>blue<head> sky, or proprietary creation tactics?	blue	blue	sapphire	speculative
Carbs will fast-flame but then you go into low blood sugar and you start to feel <head>blue<head> and will forget what delirious pleasure it is to be a Bottom Feeder.	blue	sad	unhappy	down	depressed	blue	melancholy
Phalanxes of hookers re-emerge on Bourbon Street, music fills the air, the night turns <head>blue<head>.	blue	naughty	indecent	pornographic	shady	blue	cobalt
Every time I got <head>blue<head>, I would put on the song, turn it up really loud and dance around the living room for twenty minutes and I would feel better.	blue	sad	depressed	blue
I.ve never once had my skin turn <head>blue<head>, or had any real problems with circulation.	blue	blue	grey	purple
The first is that the " check " buttons on the WEB form do not stop respondents <head>checking<head> more than one response at a time.	checking	select	tick	check	examine
We recommend that you <head>check<head> with us beforehand.	check	check	make sure	verify	report
Bear unfortunately had to <head>check<head> himself into an asylum for doing all this.	check	put	check	admit	submit
Many schools in the area also use hand-held metal detectors to randomly <head>check<head> students for weapons.	check	search	check	examine	inspect	scrutinise
And if we just <head>check<head> the right boxes on the vote cards, we 'll get closer!	check	select	mark	check	tick	examine
You may <head>check<head> the status of their security certificate at any time during the checkout process.	check	check	note	confirm
<head>Check<head> the shoulders so it hangs well, stops at hips or below, and make sure the pants are long enough.	Check	check	look at	test	take notice	inspect	survey	scrutinise
Have your posture or muscle strength <head>checked<head> at a health fair or another free screening program.	checked	test	check	look at	examine	verify	inspect
I have <head>checked<head> multiple times with my order and that is not the case.	checked	check	make sure	confirm	verify	investigate
Customers who have printed their own boarding passes from Continental's portal can go directly through security to their flight gate, if they have no bags to <head>check<head>.	check	check	hand in	inspect	scrutinise
The elderly simply can't afford current prices, dentists, and there's not doubt at all that if they could that backlog could be <head>cleared<head> very quickly.	cleared	remove	clear	get rid of	eliminate	dealt with	sort	process
The McCarthy brothers who run the place are great hosts, and between them, their gourmet fare and an excellent reading room with a well-tended fireplace, I am well taken care of until the weather finally <head>clears<head>.	clears	change	clear	improve	brighten
You probably wouldn't even notice the 30 cars down the track that weren't damaged in any way, and are ready to move forward as soon as the track is <head>cleared<head>.	cleared	clear	empty	unblock	tidy	unobstruct
The design team opted to <head>clear<head> a large area of trees behind the 4th green to help give the hole the same sense of drama and scale as one experiences when standing on the 10th tee of The Old Course at Sunningdale.	clear	clear	cut down	remove	move away	open up	eliminate
With the sun just barely <head>clearing<head> the horizon, Mike switched to a split-shot rig.	clearing	above	over	get above	clear	skim
Orders will be on hold until payment is received in full and or check <head>clears<head>.	clears	cash	clear	be authorised	release	be freed
This is the furthest point till which bodies have been <head>cleared<head>.	cleared	remove	move	clear	take away
Marine generals have <head>cleared<head> other infantrymen in somewhat similar circumstances, such as the Fallujah shooting, because of the nature of the combat the Marines are seeing in Iraq.	cleared	clear	pardon	authorise	acquit	vindicate	exonerate
When he stands, he begins to <head>clear<head> the dishes from the table.	clear	take	remove	clear	tidy
Here they oppose bikeways, claiming that these bikeways are intended to <head>clear<head> the roads for motor transportation for the convenience of the motoring elite.	clear	free	clear	unblock	tidy
We look forward to seeing you at one of our branch meetings in 2003. ^ Back to top NEW YEAR GREETINGS AND THANKS FROM YOUR CREDIT UNION As another year has drawn to a <head>close<head>, The Board and Staff of Holiday Coast Credit Union wish members, their families and friends, a happy, safe and prosperous New Year.	close	end	finish	close	conclusion
A motion to suspend Standing Orders shall be open to debate and the suspension shall cease no later than the <head>close<head> of the meeting.	close	end	finish	conclusion	close
For the Winnipeg Commodity Exchange and the Chicago Board of Trade, the <head>close<head> of trade is 115 P.M. CST.	close	end	finish	close	conclusion
The final act of this imaginative drama, which brings it to a <head>close<head>, which marks the last stage of the connected series, is the end as end-in-view.	close	end	finish	close	conclusion
They do, however, make the German advance exponentially easier, and 1928 comes to a <head>close<head> with the Allies ' triumphant conquest of Denmark.	close	end	finish	close	conclusion
The fun begins at an engagement party for Fiona's cousin, Elizabeth, and doesn't end until novel's <head>close<head>.	close	end	close	conclusion	finale
This leads to a race condition where another thread could have reused the filehandle before the second <head>close<head> would be executed.	close	close	shutdown	conclusion	shut
As 2002 drew to a <head>close<head>, his regime worked hard to counter anything that might be seen as supporting the coalition's assertion that WMD still remained in Iraq.	close	end	finish	close	conclusion
22 I spoke for fifteen or twenty minutes, and was surprised at the <head>close<head> of my address to receive the hearty congratulations of the Georgia committee and of the members of Congress who were present.	close	end	finish	conclusion	close
There is also an unfortunate deus ex machina used to push the book to its <head>close<head>.	close	end	finish	close	conclusion	finale
Scream all you like: no one will be <head>coming<head> to rescue you.	coming	come	arrive	appear	turn up
Now we have to <head>come<head> together again " to help the people of Iraq.	come	come	join	gather	unite	combine	rally
When it <head>comes<head> to music, the figures don't tell us anything new really.	comes	come	be about	we consider	concern	considering	be connected with
This is why we hear open source and embedded-friendly strategies <head>coming<head> from companies like SAP, Oracle, IBM, Sun, HP, and many others.	coming	arrive	proposed by	come	appear	originate	report	emanate
I <head>came<head> home, partly sad, partly revolting and wrote an article on caste and class in India today and since I wasn't a journalist I wrote 38 pages!	came	come	get	reach	arrive	return
Posted by: fling93 | May 31, 2005 at 03:39 PM It has long been the case that Japanese TV programming does not <head>come<head> in 30 minute chunks.	come	happen	take place	be not organised	arrive	occur
" The Blair Witch " movie <head>comes<head> to mind. it very much reminds me of something starting out as a solid and going straight to a gas. anyway, thought i 'd throw that out there. and if someone could point me to where " cult " stuff is folded into all this - i 'd appreciate it.	comes	come	enter my	occur	spring	occur to one	spring to mind
The time will <head>come<head> when the Fed will no longer be able to dictate low interest rates.	come	come	arrive	take place	occur
Thing the wagon was secured I moved forward, thud���� It had <head>come<head> off and was rolling down the property.	come	come	fall off	leave	lever
This is the type of pub you 're most likely to <head>come<head> across if you 're visiting London.	come	come	notice	happen	encounter	chance upon
Babies over 6 months or so may <head>cry<head> from being uncomfortable or hungry, or because they remember you when you are not there and they know how important you are to them.	cry	cry	weep	wail	bawl	snivel
Rachel still <head>cries<head> out from the grave for her children who are no more.	cries	cry	call	shout	wail	shriek
They were now joined by some of the governments ' backbenchers, who began to <head>cry<head> for " a human sacrifice ": Germain had to go.	cry	call	shout	cry	demand
But the poor mother ran out of the house and <head>cried<head> aloud for her child.	cried	shout	cry	call	yell	exclaim	wail
Practically every day I noticed at least one Russian woman whose date stood her up, the signs are obvious, no, there is no <head>crying<head> or stuff like that, these are strong willed women, after she is convinced there is no possibility of you coming, she will stand up, pick up her bag and leave.	crying	cry	tear	sob
TV can make me laugh, <head>cry<head>, think, or just simply entertain me.	cry	cry	sob	weep
As the boys I teach have endeavored to enlighten me, I haven't known whether to laugh, <head>cry<head>, or go find a new job.	cry	cry	weep	sob
It is indeed a singular abuse to call that idealism which is routine and copy; a solecism which <head>cries<head> aloud to common sense for extinction.	cries	call	shout	cry	yell	utter
However, when my husband would try to put our son down for the night, he would <head>cry<head> and cry until I took over.	cry	cry	weep	sob	bawl
It seems a bit much to start <head>crying<head> that the sky is falling in the pharma industry.	crying	shout	cry	call	yell	exclaim
Schools and systems also seek quality assurance through using evaluation to assess basic competence, <head>dismiss<head> teachers for incompetence and ensure that the ' right ' people are promoted to key positions.	dismiss	fire	dismiss	lay off	sack	discharge
If we see ourselves as separate from the world, it is easy to <head>dismiss<head> our actions as irrelevant or unlikely to make any difference.	dismiss	see	ignore	reject	dismiss	deride
When students must leave school for any reason during school hours they must present a note from their parent/guardian to the office for approval and then to their teacher to be <head>dismissed<head> from class.	dismissed	let out	release	dismiss
By law and by contract professional status employees cannot be <head>dismissed<head> if a non professional status employee is retained in a position the tenured person has the certification to teach.	dismissed	fire	dismiss	lay off	discharge	sack
Brochures or fliers, however glossy, tend to be impersonal and may be <head>dismissed<head> as " junk mail.	dismissed	see	ignore	reject	dismiss	deride
The Enhanced Bus Service Alternative was <head>dismissed<head> from consideration because it would not meet the Purpose and Need of the Project.	dismissed	remove	reject	discard	dismiss
When the visitors have left, she <head>dismisses<head> Suzuki and prepares herself for a ceremonial suicide.	dismisses	send away	release	dismiss	excuse	discharge
" Simply thank your Gremlin for his or her opinion, <head>dismiss<head> him or her, and ask your true inner voice to turn up its volume.	dismiss	send away	dismiss	excuse	discharge	banish	dispatch
Some have been fined and warned by the police to <head>dismiss<head> their illegal workers.	dismiss	fire	dismiss	discharge	sack
Back to top Trade unions An employee has the right to join a trade union, and should not be refused a job, <head>dismissed<head>, harassed or selected for redundancy because they are a member of or wish to join a trade union.	dismissed	fire	dismiss	lay off	discharge	sack
4 Each Party shall <head>draw<head> the attention of all other Parties to any activity which in its opinion affects the implementation of the objectives and principles of this Protocol.	draw	call	bring	draw	focus	summon
The data presented here are <head>drawn<head> from the questions concerning women����s time use and social roles.	drawn	take	pull	extract	draw	acquire
We also illustrate the themes by <head>drawing<head> on the contributors stories.	drawing	use	make use of	take from	draw	consider	focus	employ	exploit
The Board has <head>drawn<head> heavily on the best brains in the educational measurement world and conducted more research than any other body in developing its certification system for teachers of accomplished practice.	drawn	use	make use of	take from	focus	consult	employ	draw	exploit
He said you don't <head>draw<head> a tree just like that with a bush around like that.	draw	draw	paint	sketch	portray	depict
This group includes persons who <head>draw<head> a wage or salary for their work in their own incorporated enterprise.	draw	get	earn	receive	draw	obtain	claim	derive
Approximately 150 York community members were present, <head>drawing<head> connections between on-campus institutions and the US empire.	drawing	use	make	draw	lead to	employ	exploit
The town is prettily situated on a hillside in the western curve of the bay, and moving about the roads we caught our first glimpse of the Cape wagon <head>drawn<head> by sixteen oxen.	drawn	pull	drag	draw	haul
Refund cheques are made payable to the student from whose account the credit amount is <head>drawn<head>.	drawn	take	remove	draw	withdraw	obtain
The following examples highlight the risk: A non-league club is <head>drawn<head> against Manchester City in the third round of the FA Cup.	drawn	choose	set	play	select	schedule	draw	tie	pit
Finno-Ugrian languages, in the widest sense of the word, share a few core vocabulary items, though when critically examined, the number of satisfactory etymologies appears smaller than was thought <head>earlier<head> (Janhunen 1981; Sammallahti 1988).	earlier	before	earlier	initially	previously	formerly
If you wish to collect your robes <head>earlier<head> you should contact the above number to arrange collection.	earlier	before	earlier	sooner	beforehand	prior to that
It is possible that if he had gone <head>earlier<head> he may have recovered.	earlier	earlier	sooner	previously	in advance	beforehand
Finding it <head>earlier<head> would have saved me lots of time and made it easier to work with my architect.	earlier	before	earlier	sooner	beforehand
I came to this realization later than some older and more perceptive scientists, but, even so, <head>earlier<head> than many others.	earlier	before	earlier	sooner	sooner than	in advance of	ahead of
Many countries have changed policies to allow investments that <head>earlier<head> might have been prohibited or been otherwise difficult.	earlier	earlier	previously	in previous times	beforehand	formerly
<head>Earlier<head>, during World War I, Hitler was an isolated human being, scorned for his strange pathetic ramblings.	Earlier	earlier	previously	beforehand
I mentioned that I would be seeing this new Dr regarding counselling and psychology, Jan thinks it is a good idea and it would probably help me, as I 'd missed out <head>earlier<head>.	earlier	before	earlier	previously	beforehand
The key to Public Choice, as you said <head>earlier<head>, is common sense.	earlier	earlier	before	previously
We have measures in place to keep it that way, " spokeswoman Maeve O'Beirne said. [The key point is whether the US should have acted a week <head>earlier<head> given the fact that France had imported 20,000 sheep from the UK during the critical period.	earlier	before	earlier	sooner	beforehand	previously
Do not be swayed by herd constraints -- know that you are working on another level <head>entirely<head> from the rest of the world.	entirely	completely	entirely	altogether
The prohibitive cost of heroin in Alice Springs is keeping the drug off the streets but not <head>entirely<head> out of the town.	entirely	totally	fully	completely	entirely	wholly
If you link to any such websites you will leave the Business Essentials Website and do so <head>entirely<head> at your own risk.	entirely	totally	completely	entirely	wholly
Usually, these test questions are based <head>entirely<head> on the material covered in the text.	entirely	totally	completely	entirely	exclusively
Here are some of the principal sources for evidence in inductive arguments: 1. In essays on literature, the evidence comes almost <head>entirely<head> from the text of the work you are evaluating, that is, from the words on the page.	entirely	entirely	completely	exclusively	wholly
Both schemes are funded <head>entirely<head> from General Revenue and non-contributory.	entirely	totally	completely	entirely	wholly	exclusively
Still, even against all odds, they have decided to put hope <head>entirely<head> on what they see as a fresh start.	entirely	totally	completely	entirely	exclusively
Note that the expression reads in the file <head>entirely<head> in one go.	entirely	totally	completely	entirely	continuously	wholly
Their involvement depends <head>entirely<head> on what the individual wants.	entirely	totally	completely	entirely	exclusively	wholly
Avoid clich����s too - words and phrases that are so frequently used that they are <head>entirely<head> predictable and emptied of any interesting content.	entirely	totally	completely	entirely	wholly	utterly
Initially the program is focusing in on people like the photographic shops and automobile paint/repair shops and there is one other, the kind of industry that tends to put the heavy metals and so <head>forth<head> into the system more than others.	forth	on	forth	and the like
(Laughter.) Campaigns are campaigns but there are limits to the kind of accusations which should be traded back and <head>forth<head>.	forth	forth	back and forth	to and fro
Perhaps the developing countries consulted by the Chairman were not able to put <head>forth<head> their views strongly in these consultations, or the Chairman simply did not consider their views important enough to be accommodated in the text.	forth	forward	put forward	forth	express	across	advance	phrase
At one side of each factory there is a great chimney which belches <head>forth<head> black smoke and indicates the presence of the powerful steam engines.	forth	out	outward	into view	forth
I was thankful for that and when it came back, I drank it away again, and I 'm afraid to say but this became a regular pattern in my life from that time <head>forth<head>.	forth	on	onwards	onward	forward	forth
There was something of the martyr in him; he had given up better jobs to go <head>forth<head>, rake in hand, to show things up; and he wanted them to be changed.	forth	out	go out	leave	forward	advance	depart	forth
The Final Results Screen The journal, date, page numbers and so <head>forth<head> for each article are listed on-screen, one-at-a-time.	forth	on	etcetera	forth
He sent <head>forth<head> his daughter in disguise, and she waited for the criminal.	forth	out	forward	forth
The Many in ONE, Dedicate our physical embodiments to the God expression in form, bring <head>forth<head> by example, to this planet Earth Love, Light and Peace.	forth	show	about	make known	forward	forwards	forth	extract
A 10 could be units of happiness, pleasure, pain, embarrassment, and so <head>forth<head>, as well as dollars.	forth	on	forth	and the like	etcetera
These songs are far too personal, far too low, far too <head>fresh<head>, far too subjective to ever achieve I believe, that desired state of objectivity.	fresh	new	fresh	raw	novel	forward	impertinent
At first the user is impressed by the <head>fresh<head> clean smell coming out of the machine and how nice it makes their home smell.	fresh	fresh	new	pure	refreshing	airy	uncontaminated
If proof does emerge, and suspicion falls on the Ukrainian authorities, it could help rally support for Mr Yushchenko ahead of a <head>fresh<head> round of voting on December 26.	fresh	new	fresh
The trauma of finding Alyssa blue and limp and too cold is so <head>fresh<head> in my mind, I want to will it all away!	fresh	new	clear	fresh	recent	raw	vivid	undimmed
In a world where books more than one month old are out of date, this one remains current, <head>fresh<head>, and alive.	fresh	new	fresh	modern	original	novel	relevant
Though many adults work hard to sustain a relationship, this is mostly a compromise after having already invested too much time in someone and being too weary to make a <head>fresh<head> attempt with someone else.	fresh	new	fresh
Yet he creates a compellingly <head>fresh<head> vision of good business in both a material and spiritual sense.	fresh	new	different	fresh	bright	refreshing	novel
