During the siege, George Robertson had appointed Shuja-ul-Mulk, who was a <head>bright<head> boy only 12 years old and the youngest surviving son of Aman-ul-Mulk, as the ruler of Chitral.	bright	intelligent	clever	smart	bright
The actual field is not much different than that of a 40mm, only it is smaller and quite a bit noticeably <head>brighter<head>, which is probably the main benefit.	brighter	clear	bright	light	luminous
The roses have grown out of control, wild and carefree, their <head>bright<head> blooming faces turned to bathe in the early autumn sun.	bright	colourful	bright	brilliant	gleam
He was <head>bright<head> and independent and proud.	bright	intelligent	clever	bright
In fact, during at least six distinct periods in Army history since World War I, lack of trust and confidence in senior leaders caused the so-called best and <head>brightest<head> to leave the Army in droves.	brightest	capable	most able	motivated	intelligent	bright	clever	sharp	promising
An evening of classical symphonic music, played by the next generation stars in the American orchestral scene, can be savored at the New World Symphony, a special Miami institution that nurtures the best and <head>brightest<head> young symphonic musicians.	brightest	talented	most talented	bright	skilled	promising	gifted	up-and-coming
There are sound reasons for concluding that the long-run picture remains <head>bright<head>, and even recent signals about the current course of the economy have turned from unremittingly negative through the late fall of last year to a far more mixed set of signals recently.	bright	good	positive	hopeful	promising	optimistic	bright
Snow covered areas appear <head>bright<head> blue in the image which was taken in early spring and shows deep snow cover.	bright	vivid	deep	vibrant	luminous
She turns eyes <head>bright<head> with excitement towards Fiona, still tugging on the string of the minitiature airship-cum-dance card she has just received at the door.	bright	shining	bright	alight
A short excerpt: I was praying in private until someone got the <head>bright<head> idea of starting a Presidential Prayer Team.	bright	great	brilliant	clever	intelligent	smart	bright
So, unlike studio films, independent <head>films<head> cannot be conceptually geared to a marketing campaign, or used to recruit merchandising tie-ins.	films	movie	film	production	picture
The packed screening of about 100 high-level press people loved the <head>film<head> as well.	film	movie	film	picture
I think most filmmakers for the most part right now they're thinking about the DVD when they go in to production because the reality is DVD is where the great majority of your audience is going to experience the <head>film<head>.	film	movie	film	picture
Dune makes the second Lynch <head>film<head> to be released in a consumer HD format (Mulholland Drive on D-VHS being the first).	film	movie	film	picture
Film Music Literature Cyberplace - Includes <head>film<head> reviews, message boards, chat room, and images from various films.	film	movie	film	picture
His feature <head>film<head> debut HEROES / DE STÃRSTE HELTE (1996) won awards at Rouen and Madrid.	film	film	movie	picture
(Some people keep their TVs on for company.) In Malta, news is the main reason we turn to TV, followed by <head>films<head>, talk shows, documentaries, serials, and music, in that order.	films	movie	film	picture
The <head>film<head> shows Afghan mercenaries to be involved with the separatists, suggesting that the present struggle in Kashmir has been hijacked by foreign extremists, who are shown discussing the loss of Bangladesh in the 1971 war, providing it as a justification for their present acts of revenge.	film	documentary	film	movie	picture
A fine score by George Fenton (THE CRUCIBLE) and beautiful photograhy by Roger Pratt add greatly to the effectiveness of the <head>film<head>.	film	film	movie	picture
The success of Autry ' s early <head>films<head> was not enough to save Mascot Pictures, which collapsed under the weight of debts held by Consolidated Film Laboratories, which did Mascot's film processing.	films	production	movie	film	picture
That's not to say the process of actual negotiating isn't <head>taking<head> place.	taking	take	happen	occur
" Hugh Grant and Alan Rickman, as Edward and Col. Brandon respectively, <head>took<head> the most chances and the various reviewers therefore either love or hate their performances.	took	take	risk	experiment in their roles
It shouldn't <head>take<head> that long.	take	take	be	last	engage for
It only affects the start up time of a program, and for a process that <head>takes<head> several months (his code was computing the 196 Palindrome Quest), it does not matter if the initialization code takes 1/1,000th of a second or 1/10,000th of a second.	takes	take	last	occupy
If we <head>take<head> the factual context in which the term is used into consideration, then its extension becomes limited, owing to the context.	take	think about	consider	accept	include
If you don't <head>take<head> the risk of dying by driving to the store, your house could collapse on you and kill you anyway.	take	take	run	risk	accept	tolerate
The Governor <head>took<head> the big sheets of imitation parchment, glanced over them, signed his name to each, laid down the pen, and handed the papers across the table to Dreier.	took	get	take	pick up	collect	gather
O'Neill and the two men who worked under his supervision maintained the avenue, raking the thin gravel and removing any weed that tried to <head>take<head> root in the stony earth.	take	grow	take	establish itself
Even if the Anglo-French Summit did not <head>take<head> place until next year, the Prime Minister and President Chirac were still due to see each other in November and December.	take	take	happen	occur
40 Day-to-day financial and operational management is the responsibility of the Chief Officer, who <head>took<head> up her post in June 2001.	took	take	start	assume	begin
Anyway, my pants are getting <head>tight<head>.	tight	tight	small	too small	uncomfortable	close-fitting	constricting	constricted
With the physical market has <head>tight<head> as it has been in memory, silver could fly at any time.	tight	tight	low	constricted	pressurised	high-strung
More... Specialty coffee market quiet, supplies <head>tight<head> Posted at 2:57 PM by Robert Badgett By Bruce Kamich NEW YORK, June 6 (Reuters) - Specialty coffee dealers said on Friday that business was unusually quiet with most retailers ' sales numbers down from a year ago, but prices for choice beans remained firm with supplies short until the next crops become available.	tight	not easily available	scarce	sparse	tight	constricted
If your money is <head>tight<head> don't cut corners.	tight	scarce	tight	not easily available	constricted
Each child lies inside an Isolette incubator, a clear acrylic rectangle with ample room for a half-sized premature baby, though the quarters become <head>tight<head> for the full-term eight-pounders.	tight	too small	tight	close-fitting	restricted	cramped
" It can be intimidating at first, because they wrap their arms pretty <head>tight<head> around you, and everything they latch onto is pretty much headed straight to their mouth, " Schmitz said.	tight	tight	firmly	close	closely
The incisions will feel <head>tight<head> for the first 24-48 hours.	tight	uncomfortable	tight	stretched	compressed	constricted
Except for the soldiers, Goth was locked up <head>tight<head>.	tight	securely	secure	tight
Nathan Robins: Did well to keep <head>tight<head> on the Left winger and was harshly judged by the referee on several occasions to have fouled the opposing player when I felt he just out muscled him.	tight	close	close to	close by	near	tight	on top of
I know that the market is <head>tight<head> right now.	tight	low	tight	close	pressured	restricted	constricted
That's not a very high <head>bar<head>.	bar	level	barrier	bar	marker	obstruction	pole
This more upright position is most easily and affordably achieved through slapping a riser bar on your setup, and only requires you to buy a bar instead of a <head>bar<head> and stem.	bar	bar	handlebar
For twelve hours Livewire will be broadcasting live from the blue <head>bar<head> of Union House at UEA in an attempt to raise as much money as possible for a very worthy cause.	bar	bar	pub	saloon	drinking house	hostelry
The British government imposed a colour <head>bar<head> in its colonies, so young blacks went in only for law or medicine where they could make a living without government support.	bar	restriction	ban	prohibition	exclusion	bar
Put granola <head>bars<head> in bowl.	bars	bar	biscuit	snack	block	slab
It's been a criticism of IE's scrollbar CSS and also stands for the status <head>bar<head>.	bar	bar	menu	indicator	banner
2) Straddling the center bar, your child should be able to keep both feet flat on the ground with about a 1-inch clearance between the crotch and the <head>bar<head>.	bar	bar	pole	rod	metal	apparatus
Abstract: Analysis of contact between two chromosomal races of house mice in northern Italy show that natural selection will produce alleles that <head>bar<head> interracial matings if the resulting offspring are unfit hybrids.	bar	bar	pub	saloon
Seventy-five percent of my clientele that comes in there, they are just like a person on a Friday afternoon going into a <head>bar<head>, and he sits at the counter, and the bartender knows what he wants to drink.	bar	lounge	bar	pub	drinking lounge
The night is long at the numerous other discos and clubs, but for those seeking something more sedate there are quieter, sophisticated <head>bars<head> in the hotels.	bars	prevent	block	obstruct	exclude	bar
When Time magazine's cover portrays millennium nuts as deranged, crazy Christians holding a <head>cross<head> as it did last month, boycott their magazine and the products it advertises.	cross	cross	crucifix
Four-Set in a <head>cross<head>, the points meeting in water surrounded by luminous crescents.	cross	cross	x shape	crucifix	two intersecting lines
It was designed in the form of a <head>cross<head> with a cast iron sword placed where the cross members join.	cross	x	cross	crucifix	two intersecting lines
Triticale, a <head>cross<head> between wheat and rye, matures later than rye but earlier than wheat.	cross	mixture of	hybrid	hybrid of
Old Nick got tired of cussing, was humiliated at being sat on, and hurting like the torments of Hell for being so close to the <head>cross<head>.	cross	crucifix	cross
By 1924 he managed to transmit across a few feet the flickering image of a Maltese <head>cross<head> and on 26th January 1926 he gave the world's first demonstration of true television in his attic workshop before some fifty scientists.	cross	crucifix	cross
He appeared to his apostles and spoke to them about God's kingdom. ' Acts 1:3 Jesus took the consequences of our self-centredness by giving up his life on the <head>cross<head>.	cross	cross	crucifix
If power cycling occurs, care must be taken to account for the " dead time " between shutdown and power up when the latchup <head>cross<head> section is evaluated.	cross	cross	segment	sequence	transverse	right angled cut
" Mixed race people represent a diverse <head>cross<head> section of racial, ethnic, and cultural heritages, with many multiracial individuals identifying with multiple communities, " the organizations stated.	cross	mixture	sample	typical sample	cross
I can only judge keyboards by going into somewhere like PC World and physically trying them, and I do not want to go into somewhere like PC World, as I do not want to get <head>cross<head>.	cross	angry	annoyed	irritated	irate	cross
Mr. Hall's old factory is still on Oklahoma Avenue, but the metal fabrication plant where Mr. Larson worked <head>finally<head> closed last year after withering for decades.	finally	eventually	finally	ultimately	at last
<head>Finally<head>, this new rule will also have the effect of encouraging existing corporations to produce safer products, in keeping with the public policy goals that underlie product liability law generally. [Fn.	Finally	finally	in conclusion	lastly
However, this easy clearing method has muddled the issue quite a bit, since now Explorer is not actually being cleared at all, while Gecko browsers have <head>finally<head> been corrected so they do clear all previous floats.	finally	finally	at last	at long last	eventually
<head>Finally<head>, Adam sees the ID card being used as an authenticator because it might be declared "trustworthy&#8221;.	Finally	finally	eventually	lastly
He said, " OK, first, I 'd like to have a face like Clark Gable, then, I 'd like a build like Arnold Schwarzenegger, and <head>finally<head>, I 'd like sexual equipment like this here horse I 'm riding.	finally	finally	also	lastly
<head>Finally<head>, I interviewed Eric Howes, a noted spyware researcher at the University of Illinois, who has found that today's most popular anti-spyware software packages are far less effective than many believe (see sidebar, below).	Finally	finally	lastly	eventually
However, you will get those NSF fees reimbursed by the bank as well - it will just come when they <head>finally<head> process everything together.	finally	finally	eventually	at last
<head>Finally<head>, the Army has conducted range characterization activities regarding the potential for contamination from munitions residues at 17 ranges throughout the United States, assessing the different types of ranges used by the Army.	Finally	finally	at last	eventually	lastly
<head>Finally<head>, it is outlined how a mesoscopic theory should be constructed for a particular scanning tunneling microscopy experiment in order to overcome the failure of a corresponding reaction&#150;diffusion model to quantitatively reproduce the experiments.	Finally	in conclusion	lastly	last of all
<head>Finally<head>, the proposed disposal rule would apply to transfer agents registered with the Commission.	Finally	finally	lastly
Up to sixty percent of the fatty acid content in the grasses on the plains contain omega-3 and are <head>found<head> in abundance in buffalo allowed to graze on the natural grasses.	found	find	present	discover	exist	detect	evident
If you find yourself caught up in negative thoughts and <head>find<head> that you suddenly expect the worst it will be impossible to perform at your peak.	find	feel	realise	find	discover
Search Customer Reviews 9 of 10 people <head>found<head> the following review helpful: Early feminist literature - memorable, November 21, 2000 Reviewer: M. J. Smith (Seattle, WA USA) - See all my reviews This book consists of a gem of a story and a mediocre afterward.	found	find	think	believe	felt	discover
Well they have a friend named Morgan and Morgan told them to <head>find<head> an object that he wants.	find	look for	find	seek	discover	locate
Consistent with previous findings, lack of congruence was <head>found<head> to be a precursor of intrusiveness.	found	find	see	believe	show	discover
nokia mobile phone cases, motorola cell phone cases, motorola cell phone case, body glove cell phone case I think the best place where you can <head>find<head> CELL PHONE CARRYING CASE is eBay.	find	buy	get	find	discover
Oh, and as far as the Kool-Aid jokes, <head>find<head> your own material.	find	find	get	write	obtain	invent	discover	locate
But much that we once accepted as inevitable, we now <head>find<head> absolutely intolerable.	find	think	find	see as	believe	consider	feel	realise is	perceive as
SpeedUpMyPC automatically <head>finds<head> the best settings for your PC and carefully controls your system resources to give you the best performance.	finds	find	determine	calculate	discover	locate	ascertain
If Bessler had indeed discovered some mechanical way of creating perpetual motion, perhaps the only way it is explainable is if he had <head>found<head> a way of extracting the energy from this Aether.	found	find	discover
The Transcendental Meditation people advertised this: " Meditation can <head>fix<head> many sicknesses.	fix	cure	heal	fix
Now, I 'm not sure how I went from missing two weeks to six, but intend to <head>fix<head> that as I go.	fix	correct	make up for	sort out	fix	repair	compensate for	mend
' ' I feel I can get a lot more done as a selectman by being innovative and <head>fixing<head> the problems we have with cash flows, because they occur every year.	fixing	solve	resolve	repair	mend
Getting back to the day when doctors looked at the whole person.and did not expect a pill to <head>fix<head> the mind.	fix	cure	heal	fix	mend
And thanks to our users, we now have around 30 engines in the database... New features: - Better layout - Better copy - Small bugs <head>fixed<head> Bugs: - ie hell + much more Posted by eric at 05:24 PM | Comments (3) Investment News As part of the new international expansion strategy 24hdc.com now accepts USD for investments.	fixed	fix	correct	repair	resolve	cure	patch
Er, tilty. by anna at July 17, 2003 03:37 PM yeah, in our case, whoever did the foundation fucked up royally. when the house settled, it was fubar. should be pretty easy to <head>fix<head> though...just a matter of getting the pilings set to the right heights. by JC at July 17, 2003 06:32 PM add a comment Name: Email Address: URL: Remember personal info?	fix	fix	repair	correct	sort out	mend	put right
I guess I 'll be able to hit the hot button many times as I 'm always at the dealer getting my car <head>fixed<head>.	fixed	repair	fix	mend
The long-term problem with Social Security after 2042 could be totally <head>fixed<head> by raising the cap on income to a level needed to generate sufficient income to enable the system to continue to pay 100 percent indefinitely.	fixed	solve	fix	resolve	correct	mend
The only way to <head>fix<head> this is for linux to get enough market share to be able to make demands for hardware support. [reply] [top] [Â »] Releasing specs is the only answer. by The Nose Who Knows - Feb 26th 2001 04:29:40 &amp;gt; The other reason why vendors don't support linux &amp;gt; most of the time for commidity hardware such as &amp;gt; webcam is low returns on investments.	fix	do	fix	solve	correct	resolve	mend
But if no prayers can alter your purpose, dear one, husband, if you are so <head>fixed<head> on going, take me with you, also!	fixed	determine	set	stick	intent	fix
Suddenly there was a scattering of fire, which three outfielders caught the brunt; the centerfield was hit and was captured, left and right field <head>managed<head> to get back to our lines.	managed	manage	be able	succeed	endeavour
" C158 (cf ex R145) " The Provincial in Councilor the Superior ofthe Delegation in Councilsets the financial competency of local Superiorsand their Councilsand determines which assets can be <head>managed<head> by individualOblates and by local Superiors and their Councils.	managed	control	manage	handle	organise	direct	oversee
BUSINESS DEVELOPMENT MANAGER STRATEGIC ALLIANCES This individual will be responsible for coordinating, negotiating, launching, and <head>managing<head> Accuity's partner relationships.	managing	manage	take care of	organise	control	direct	look after
A married woman retains ownership of any property she brought to the marriage, but the husband has the right to <head>manage<head> the property and to enjoy profits from the property.	manage	control	manage	organise	govern
We do not need to ask for your specific permission to do these things, as explained below: Treatment Partners health care providers will use and share your health information to provide and <head>manage<head> your health care and related services.	manage	manage	deal with	organise	control	coordinate	direct	conduct
According to a White House press release, al-Taqwa and its affiliates " raise, <head>manage<head>, invest, and distribute funds for al-Qaeda; provide terrorist supporters with internet service and secure telephone communications; and arrange for the shipment of weapons.	manage	manage	organise	control	handle	take care of
That is, if the average person (say this is 98 % of people) amasses 10 things, if I <head>manage<head> to acquire 20 things then perhaps my account is not worth twice as much but maybe 10x or 100x as much as average.	manage	manage	be able	succeed in	success
There are different types of <head>managed<head> care systems.	managed	control	manage	administer	coordinate
Saddam Hussein didn't <head>manage<head> to defeat the Iranians.	manage	manage	be able	success	contrive
The M107 program is <head>managed<head> by the Project Manager Soldier Weapons with engineering support provided by PicatinnyÂs Armament Research, Development and Engineering Center.	managed	manage	run	control	direct	conduct	administer
It is really a <head>neat<head> plan, well documented and a model for libraries that are still working on their plans. ~ ~ ~ Corrections to April 2003 issue of LDD On the Road: Some things slipped by when putting together last month's issue of LDD On the Road.	neat	good	clever	neat	well-formulated	orderly
And the prize for <head>neatest<head>, simplest idea has to go to britkid.org, a resource for opening children's eyes to the diversity of our culture. www.skoool.com www.nrich.maths.org.uk www.stagework.org.uk www.learningcurve.gov.uk www.britkid.org Email Hotmail is the free email service everyone knows.	neatest	smart	clever	neat
Over the course of the 20th century scholars have learned that such images tried to make messy reality <head>neater<head> than it really is.	neater	simple	tidy	neat
Strong field patterns created by hedgerows give the landscape a <head>neat<head>, well structured appearance.	neat	tidy	neat	orderly	order
Besides a list of specific things you wish they would talk about, the following things are helpful additions to the <head>neat<head> packet you hand them when you ask them to write the letter.	neat	simple	tidy	neat	compact	trim	orderly
" -4 Time IROC Champion Mark Martin Indy 500, CART and IROC champion, Al Unser Jr. said, " I watched my father and uncle Bobby race in IROC and as a kid I thought it would be really <head>neat<head> if someday I would get an opportunity to run IROC.	neat	cool	great	pleasing
The Society for Academic Emergency Medicine is a <head>neat<head> little bunch of people who are dedicated to furthering the interests of academia and research in the youngest of the medical specialties.	neat	nice	great	cool	tidy	neat	orderly
A weblog by Tom Coates who thinks up <head>neat<head> stuff for Yahoo!	neat	great	cool	clever	neat
But not as odd as the 35 others who bedded down with him each night in a <head>neat<head> row down the street on a carpet of cardboard boxes and multicoloured raffia beach mats.	neat	tidy	ordered	uniform	orderly
Link to the full FEDERAL GOVERNMENT DEBT REPORT with pictures - there are 9 color graphics that tell the whole story - - so, give the next page time to load those <head>neat<head> pictures.	neat	great	cool	terrific	neat
What are the important variables that create a <head>rich<head> online learning experience, one that makes real improvements in academic practice?	rich	rich	full	rewarding	detail
Trees on Anmyeondo used to be thick and lush to the extent of prompting a saying, Â¡Â°You can become <head>rich<head> with an axe.Â¡Â± But now only few trees are left due to reckless deforestation since the time of KoreaÂ¡Â¯s liberation from Japanese colonial rule.	rich	rich	wealthy
No, we 're not talking about the fortunes of a <head>rich<head> and powerful democracy.	rich	rich	wealthy
Functional Foods and Drinks, Sports Drinks, Slimming, Supplements Functional foods: Glico launches this chocolate <head>rich<head> in GABA for its relaxing effect.	rich	full	full of	high	packed with	abundant	abounding
Africas central problems in the WTO revolve around the imbalances and biases created by <head>rich<head> countries in the Uruguay Round Agreement (URA).	rich	rich	wealthy
Today half the world's population lives on less than $ 2 a day, 80 percent of the global population has only 20 percent of global GDP, and within each country there is a massive imbalance between <head>rich<head> and poor.	rich	rich	wealthy
Here Wagner, in depicting every shade of sexual love, developed a style <head>richer<head> and more chromatic than anyone had previously attempted, using dissonance and its urge for resolution in a continuing pattem to build up tension and a sense of profound yearning; Act 2 is virtually a continuous love duet, touching every emotion from the tenderest to the most passionately erotic.	richer	rich	vibrant	full	elaborate	lavish
He brings an incredibly <head>rich<head> and diverse background that includes everything from executive coaching, learning &amp; development and management consulting, to senior operations roles, mixed with a masters in organizational development.	rich	rich	full	significant	detailed	valuable	ample	lush
<head>Rich<head> people manage their money well.	Rich	rich	wealthy	well-off
I also think that it will probably take the " sword " of nations (ala Rom 13) combined with the good news offered by the body of Christ to touch the hearts and change the ways of the " rich Africans " (and <head>rich<head> Americans and other westerners, frankly) to bring change.	rich	rich	wealthy
Rubinstein held the gambit pawn with 4.Bf4 and 7.Qd5, but his neglect of kingside development was <head>severely<head> punished.	severely	seriously	severely	harshly	gravely
This veteran, the oldest pensioner in Great Britain, entered the army in 1758, and was <head>severely<head> wounded at the battle of Quebec under General Wolfe, in consequence of which he became an out-pensioner of Chelsea Hospital, and continued so for the period of seventy-five years.	severely	badly	seriously	severely
Perhaps the effect of West Nile Virus is sufficient to extinguish endemic birds already <head>severely<head> stressed by habitat losses.	severely	seriously	highly	extremely	severely	gravely	critically
