The question is not an issue of supply and demand because the claim under examination is not " We are going to <head>charge<head> a lot because we can get that price.	charge	ask	charge	demand	cost
So who are the people being <head>charged<head> with stolen property? he asked.	charged	charge	accuse	accuse of	accuse having	indict
Commission is the amount <head>charged<head> to execute a trade.	charged	take	charge	demand	impose	levy
Realizing immediately that strangers have come, the animals <head>charge<head> them and the horses began to fight.	charge	attack	rush at	charge
Going to Court: Civil Trial Procedure This pamphlet explains what happens when you go to court about <head>civil<head> cases involving negligence or damages.	civil	civil	private	ordinary private	civic
With all due respect to our <head>civil<head> authorities and lawmakers, we are called to testify by word and action, to the essential truths of our faith.	civil	public	state	elected	civil	civic
It is contrary to the spirit of <head>civil<head> law, and to the natural working of economic law.	civil	state	civil	civic	ordinary private	noncriminal
Yes, we occasionally get into some heated discussions here, and the language can get a bit colorful at times, but in general, the posters are relatively <head>civil<head> and well-behaved.	civil	polite	inoffensive	cordial	civil
Lionel, Singapore Lebanon has overcome all adversities in the past, ranging from <head>civil<head> wars to Israeli invasion.	civil	people's	civil	internal	domestic
This means combating corruption, building strong and accountable public sectors which have the necessary staff to deliver vital services, and ensuring that parliaments, <head>civil<head> society, and the media can monitor public spending and act as watchdogs against corruption.	civil	public	general	nongovernmental	civil	polite	civic
Truly classy people find a way to be polite, <head>civil<head> and courteous.	civil	friendly	well mannered	thoughtful	cordial	benevolent	civil
Not just another period piece on Germany���s disturbing past, this film should have deep resonance for today���s movie fans who are concerned about <head>civil<head> and human rights.	civil	community	individual	personal	civil	civic
Spontaneous gestures are a pie in the face of <head>civil<head> society.	civil	polite	friendly	cultured	public	ordinary	civil
Since <head>civil<head> discourse in our country is increasingly lacking, and the word insanity in this context implies a lack of such civility, how can that be a good thing for anybody or the mark of a great president?&#8221; Eh, one episode, wha-evuh.	civil	polite	social	civil	courteous
Or I could have been <head>cleaning<head> out closets, nursing a mono-stricken child, and playing Santa.	cleaning	clean	clear	empty	tidy	purge
4.2 Dog and horse owners should be encouraged to <head>clean<head> up after their animals.	clean	clean	clear	tidy	scrape
On Wednesday, Democrats across America joined together to restore truth and trust to government, and to <head>clean<head> up the Republican culture of corruption that has pervaded our nations capital.	clean	clean	clear	correct	cleanse	mend	rectify
" She looked up at Crono, who was <head>cleaning<head> the blood off his sword.	cleaning	clean	wipe	remove
That's good because we got a lot done, but now there is a definite and obvious need to <head>clean<head> up.	clean	finish	clear	complete	restore
The first one to <head>clean<head> their bowl completely wins.	clean	empty	clean
I was always showing up late, having accidents on the way to work and having to go home, <head>clean<head> up and change.	clean	wash	wash up	freshen up	tidy up	spruce up
Grace has the money to <head>clean<head> up.	clean	clean	clear	win	prosper	profit greatly	accumulate
But mainly the wound had wanted to <head>clean<head> itself.	clean	clean	clear	cleanse	disinfect	purify
Do they want us to <head>clean<head> up the mess while they take the no cost high road of publicly condemning our unilateral military action?	clean	clean	clear	fix	correct	repair	tidy	remedy
It is interesting to note that when Mr Cleary inaugurated the motor rail service in 1911 it was on a three months trial with the postal authorities who insisted that this be followed by a <head>coach<head> and five horses all the way to ensure its safe arrival.	coach	coach	carriage
But the lack of 2004 success has the axe poised over rookie Pigs <head>coach<head> Mark Watkins.	coach	trainer	coach
I invite you to become part of this community of commitment and to begin your journey toward becoming a masterful <head>coach<head>.	coach	teacher	trainer	coach	instructor	counsellor
As a <head>coach<head>, we speak and listen with the intent of helping people surface, question and reframe assumptions.	coach	trainer	coach	instructor	tutor
The Championship by-law states that the SA will pay 100 % of travel, accommodation, uniform for <head>coaches<head> and airfare too(?	coaches	bus	trainer	coach
We have also proposed that they continue to encourage ways of giving greater priority to <head>coaches<head> on the national road network following the successful introduction of a dedicated lane on the M4 Spur to Heathrow.	coaches	bus	travel bus	coach
" My <head>coach<head> arrived very late last night and I haven't yet unpacked my belongings.	coach	bus	transport	coach	carriage	trainer
Besides function <head>coaches<head> for common activities, the train would have sleeping cars (wagons lites) with individual compartments.	coaches	coach	car	carriage
We hopped back onto the <head>coach<head> - now for the boulangerie!	coach	bus	coach	carriage
This is also at the very essence or heart of being a <head>coach<head>.	coach	teacher	trainer	coach	tutor
Mowing The way that you mow your lawn will also affect how well it survives hot, <head>dry<head> conditions.	dry	dry	rainless	drought	parched	arid
Clinical trials burn money fast, putting companies in a precarious position if they don't get definitive results before their bank accounts run <head>dry<head>.	dry	out	empty	run out	dry	become empty	evaporate
Surprisingly in such a <head>dry<head> continent as Australia, salt becomes a problem when there is too much water.	dry	dry	arid
For people who knew him, it was typical of his <head>dry<head> humor, but some in the audience thought he was tipsy.	dry	dry	understated	low key	impassive	wry	facetious
The romance is uninspiring...and <head>dry<head>.	dry	boring	uninteresting	dry	unsympathetic
Part c) All this has been a little <head>dry<head> so far: now for some fun.	dry	boring	uninteresting	dry
Perhaps more than anything what one loves about this book is Fowler's incisive <head>dry<head> wit.	dry	dry	wry	tongue in cheek	droll	deadpan
The problem is, Aari seems to have no memory of their love other than a <head>dry<head> recitation as if he is reading a script of who he is supposed to be.	dry	boring	uninteresting	flat	dull	dry	soulless
She proved that in two years in Illinois they had voted ninety-six towns dry, and that at that rate we would soon get over Montana and have it <head>dry<head>.	dry	dry	teetotal
If the mixture is too <head>dry<head>, add some water; if it is too soft, add some flour.	dry	dry	unmoistened	stodgy	desiccated
Dave Chalmers: You can imagine that in 100 or 200 years there��s going to be Sim Universe, everyone��s going to have an entire simulated universe on the desk top, there will be virtual realities that people could interact with, that will provide the <head>full<head> richness of an entire life.	full	total	full	complete	abundant
It's a beatiful album <head>full<head> of the type of songs that we 're rarely heard from the Pumpkins.	full	full	filled	filled with	packed with	brimming with	replete with
What we need is accountability; we need offenders prosecuted with the <head>full<head> weight of the law, so that this behaviour is eradicated.	full	full	whole	total	entire	complete
The patent is granted in return for <head>full<head> disclosure of the details of the invention.	full	total	complete
Because of the intermittency and variability of the wind, conventional power plants must be kept running at <head>full<head> capacity to meet the actual demand for electricity.	full	full	total	top	maximum	highest
He tends to wear a doublet, a shirt with <head>full<head> gentlemanly blousing sleeves, kneelength trousers, and slippers.	full	full	big	complete	voluminous	ample	generous	overflowing	ruched	gathered
However, once I got a <head>full<head> load of clients, I realized that my income potential was being limited.	full	full	complete	maximum
Of course, seeing how much fun he has finger feeding himself a high chair tray <head>full<head> of mashed banana (some will actually go in his mouth) is worth just about anything.	full	full	filled with	covered with	loaded with	packed with	crammed with	brimming with
Be sure to read the <head>full<head> story.	full	full	whole	entire	complete
Any podium, fax, phone, or mail bids that do not conform to a full or half increment will be rounded up or down to the nearest <head>full<head> or half increment.	full	full	whole	entire
The wind is testing its strength, Blowing down to the ants ' path With its tiny pebbles, Down to the tiny <head>heaps<head> of gravel, Down to all the heaps of gravel.	heaps	pile	heap	mound
Regards George Melky Hey guys, thanks <head>heaps<head> for the fabulously run race today.	heaps	a lot	lots	loads	tons	heap
By the time you 've finished your dinner you 've got nothing but a garbage <head>heap<head> on your plate.	heap	pile	heap	mound
If it is a good category system there should not be too many left over in the Miscellaneous <head>heap<head>, and there should not be too many that you want to assign to more than one category.	heap	collection	pile	category	heap
Composting is carried out by accumulating dung, domestic and other wastes in a <head>heap<head> or pit.	heap	pile	heap	mound
It took along time to get to the point where I could smile at the thought of her rather then collapse into an emotional <head>heap<head>.	heap	mess	state	wreck	pile	heap	bundle
In 1978, a Ford Mustang II (my first car, and trust me it was a <head>heap<head>, but it was cheap) cost about $ 3,500 brand new.	heap	mess	wreck	pile	heap
It's a hodgepodge, a humongous <head>heap<head> of tips &amp; tricks, hortations with no underlying concepts.	heap	mess	pile	untidy pile
Some years ago several key chefs from Fore Street had been snatched up to make this cantankerous <head>heap<head> on the water a destination.	heap	pile	mess	wreck	lump	heap
By putting them in your compost <head>heap<head>, she says, " they break everything down fast and beautifully.	heap	bin	pile	heap	mound
It had to do a better <head>job<head> of managing the key global issues that would determine the future.	job	job	role	task	duty
His <head>job<head> was unpaid, but he was working just to keep himself fit.	job	job	work	employment	post
If this Government had been doing its <head>job<head> they would have total confidence.	job	job	duty	role	responsibility	task	function
When it's dark. ' ' She had no idea how she was going to accomplish this, but she knew that as the eldest it was her <head>job<head> to look after her two younger sisters.	job	job	duty	role	business
Martin Amis: I think he did a very good <head>job<head>.	job	job	task	piece of work	assignment
We need far better government, and we should get on with the <head>job<head> of finding it.	job	job	work	matter	task	business	assignment
Human resources professionals plan and organize their <head>job<head> tasks at Complexity Level 4. Explanation of the Complexity Levels Level 1 Level 2 Level 3 Level 4 Little variety in work activities; similar repetitive tasks.	job	job	role	employment	functional
Within days you can apply for that unreachable <head>job<head>, or show your degree to your employer and demand the raise and promotion that your knowledge and skills deserve.	job	job	position	post	career	employment	role
<head>Job<head> creation is critical to attracting new residents and giving renters the confidence to become homeowners.	Job	job	work	employment
People are thinking of something they can take home, that in some way, affirms what they believe, or how they think-and boy, it's not the <head>job<head> description of the artist to do that.	job	job	role	contract	place	employment
She was to be waiting with the other virgins - her bridesmaids and companions - who would all have oil in their lamps in case the groom should choose to come <head>late<head> in the night.	late	late	at a later hour	well into
This fits with alot of my thinking of <head>late<head> when it comes to Church.	late	late	recent	recently	lately	current
" He would come home <head>late<head> from work, put his earpieces in and listen to his favourite sports show on the radio, read the paper and fall asleep, " Tilly says.	late	late	after the usual time	after normal time	behind time	behind schedule	tardy	overdue
We were <head>late<head> doing this since I refused to use someone else's " shopping cart " system that I didn't write and couldn't trust.	late	late	behind	behind time	behind schedule	tardy
Very <head>late<head> in the movie, he finally does marry Scarlett.	late	late	near the end of	last minute	near end	far on	well into	latterly
���� There were only 10 golf clubs in the <head>late<head> 1700s.	late	end of	late	end of the	at the end of the	latter part of
T his fear of being slow or <head>late<head> is an older and more dangerous problem than it seems.	late	late	not on time	delayed	behind time	behind	behind schedule	tardy
As <head>late<head> as 1918, they elected 32 state legislators.	late	recently	late
In the <head>late<head> 60s, he moved to California, got bored and moved to Nashville where he began working on his first album titled " Old No.1 ".	late	late	end of the	At the end of the	latter part of
I married <head>late<head> and had children later and in retrospect my self absorption in my own career cheated my sons of knowing this man who taught me so much.	late	late	older	after the normal time	at a later stage	older than the norm	behind time	after the usual
My interest in Europe's defence policy is nothing <head>new<head>.	new	new	different	original	recent	additional	novel
Do not start a new page for <head>new<head> sections (chapters) or subsections.	new	new	different	fresh	additional
While there she also received a visit from the holy Carmelite Maria de Yepes, who had just returned from Rome with permission to establish a reformed convent and who provided Teresa with a <head>new<head> light on the question of the type of poverty to be adopted by her own community.	new	new	another	different	fresh	additional	novel	distinct
Tea hybrid Climbing Mme Caroline Testout Damask Rose York and Lancaster with pink and white flowers All these roses flower only on one-year old branches, which is why they have only a short flowering period followed by development of <head>new<head> branches for next year's flowers (some Damask roses, though, show a second short bloom in fall).	new	new	fresh	extra	younger	additional
Our proposals will unlock <head>new<head> ways of raising the finance needed to develop businesses, be they big or small.	new	new	different	modern	original	fresh	novel
In her welcome address to delegates, she will be announcing the publication of updated HSE guidelines on lifting and the outcome of <head>new<head> research by the Institute of Occupational Medicine, that validates the current manual handling advice.	new	new	recent	current	original	fresh	novel
I love this saddle and hate to sell it, but just doesn't fit the <head>new<head> horse.	new	new	latest	recently acquired	fresh
The lecture itself went well, but a <head>new<head> problem arose.	new	new	different	fresh	additional	extra
The announcement came just hours before a planned press conference to reveal the name of the <head>new<head> director.	new	new	latest	succeeding	recently started	fresh
These empires, with names like Ghana, Mali, and Songhay, established caravan routes that brought <head>new<head> peoples and the religion of Islam to  the areas of West Africa.	new	new	different	other	additional	fresh
BEAZLEY: I 'm a confident traveller because I do it so <head>often<head> and my experience has always been good.	often	regularly	frequently	often
When archaeologists think of alternative (or ��cult��) archaeology we <head>often<head> think of those patterns of argument that imitate conventional archaeological process and language but arrive at outlandish conclusions.	often	generally	often	commonly	frequently	recurrently
The bonnet has a coloured cord and tassels which <head>often<head> identify the institution they represent.	often	sometimes	generally	often	commonly	frequently
Tiny droplets of dew <head>often<head> form at night on cold surfaces such as grass and leaves.	often	sometimes	regularly	often	commonly	frequently
The full balance is paid on completion, <head>often<head> giving you more than 12 months to organise your financial affairs.	often	generally	sometimes	regularly	often	frequently	occasionally
We frequently add both new and old articles to the site, so check back <head>often<head>!	often	regularly	frequently	habitually
They are pinker and most <head>often<head> darker than their mothers unexposed skin.	often	usually	regularly	generally
They shall wash their hands thoroughly before starting work and as <head>often<head> as necessary while working to remove soil and contaminants.	often	much	regularly	frequently
But the great irony is that those articles are <head>often<head> sandwiched between misleading ads funded by an even more brazenly corrupt lobbyist who has evaded the law for decades.	often	sometimes	generally	often	frequently	commonly
This is something that most civilians never think about -and maybe don't understand how <head>often<head> it happens and what profound impact it has on the letter recipient.	often	often	regularly	frequently
Cattle bones were <head>only<head> present in small numbers.	only	only	just	merely
That <head>only<head> gives 200 transactions per second, a massive drop in performance.	only	only	just	barely
The argument has been set out elsewhere(24) and needs <head>only<head> be summarised here.	only	only	just	simply to	merely
Truth can be reached <head>only<head> through the comprehension of opposites.	only	only	uniquely	exclusively	purely	solely
True beauty could be discovered <head>only<head> by one who mentally completed the incomplete.	only	only	exclusively	uniquely	solely
If this practice is to be guillotined and we are not to be permittedto give notice of amendments as we proceed clause by clause,it will not be fair for those who have <head>only<head> just now joinedthe Assembly.	only	only	just	recently	hardly	barely	merely
U.S. citizens should hire <head>only<head> an authorized guide and be cautious when visiting Libanona Beach, Peak Saint Louis, or other isolated areas.	only	only	just	nothing but	solely
<head>Only<head> when the planks are inserted in the correct order, do the pictures appear proper.	Only	just	only	solely	singularly	purely
If there was <head>only<head> a way where I could take just a few minutes out my busy schedule, part-time, to grab my share of the HUGE Internet pie, this can literally mean thousands of dollars in extra yearly income!	only	just	only	merely
Know the conventions of the form you 're working in, and break them <head>only<head> when you have a good reason to.	only	only	exclusively	solely
The <head>pulses<head> were either short or long, representing the dots and dashes of Morse code.	pulses	sound	beat	beep	pulse	emanation
The river has always been the <head>pulse<head> of the town, although the reasons have changed slightly over the years.	pulse	heart	force	energy	pulse	stimulus
NON ALCOHOL RELATED QUESTIONS &amp; ANSWERS Q. I take a fair amount of exercise on a training machine, and my <head>pulse<head> is 110 at the end of the session.	pulse	heartbeat	heartrate	pulse	heartbeat rate
Most of the time, it lies hidden beneath the noise and confusion of our everyday lives, a quiet <head>pulse<head> that almost unconsciously drives us forward to this day and the next.	pulse	beat	rhythm	pulse	throb	throbbing
On examination the knee was found to be swollen, and distal limb <head>pulses<head> were absent.	pulses	reflex	throbbing
Sustained bass notes and ambient <head>pulses<head> keep things gently swirling.	pulses	beat	rhythm	throb
Prevalence of different agro-ecological tracts has made it possible to grow a multitude of over 60 crops ranging from typical tropical ones to moderate temperate varieties including cereals such as rice, wheat. maize, millet, beans, <head>pulses<head> and oilseeds: industrial crops such as cotton, jute, rubber, sugar cane, toddy palm, tobacco and spices, and many others both edible and non-edible.	pulses	edible seed	legume	pulse
It's also present in adequate quantities in dairy products, eggs and nuts, as well as in combinations of foods such as <head>pulses<head> and grains.	pulses	edible seed	legume	pulse
But he could feel the whale was sensing him with sound <head>pulses<head>.	pulses	vibration	beat	pulse	throb
She drank a great deal of coffee and had a rapid, thin <head>pulse<head>.	pulse	heartbeat	pulse	heartbeat rate	hearbeat
It was amazing how you managed to <head>put<head> together so many facts and present in such a hilarious manner.	put	put	join	gather	assemble	collate
It is best not to <head>put<head> babies to sleep with a bottle.	put	put	leave	send	place	lay down	settle
<head>Put<head> some more crushed paper on top of the component and place the next piece on top, put paper between the component and the wall of the carton.	Put	put	place	position
BARNES: Mr. Speaker, it is strange that when I try to <head>put<head> some perspective on my question, the members opposite ask me to get to the question.	put	give	present	provide	place	give to	propound
However, I 'll reserve my decision on your motion without prejudicing your position, and determine as quickly as possible the motion as it was <head>put<head> to the House and see if it does qualify, hon. member.	put	present	put	propose	place	advance
Simply <head>put<head>, the frequent claim that conventional research is essential to good teaching has no basis in fact.	put	present	put	express	give	phrase	propound
Administrators are people too; are they going to make a decision that's going to <head>put<head> people with families and children out of jobs, or are they going to make a decision that will keep those jobs safe?	put	put	make	place	leave	remove	dismiss
If you have a special poem you are doing with the children <head>put<head> it on the wall and everyone can practice it while waiting for the doors to open.	put	put	stick	place	fix	position	fasten
Getting your problems out in the open can really <head>put<head> things in perspective.	put	put	get	place	make
If you have a report from your mechanic, this might <head>put<head> their doubts to rest.	put	put	set	place	lay	nullify
He used to - he was interested - he was <head>really<head>... he always wanted to be a politician.	really	very	really	truly	definitely	absolutely	unquestionably	genuinely
He's passionate about it - it is his passion - and to be denied that is <head>really<head> hard.	really	very	really	extremely	truly	exceptionally
Some of them were <head>really<head> good but some, especially the older ones, were really apathetic.	really	very	really	extremely	truly	exceptionally
So the puzzle is that the brain seems to be getting ready to move <head>really<head> some time before we are aware that we are going to move and that we have the intention.	really	actually	in fact	properly	effectively
You can sort of challenge them well, did you <head>really<head> know the time when you said yes?	really	really	truly	actually	honestly	definitely
Is this what we <head>really<head> want for our daughters, granddaughters, sisters, and friends?	really	really	actually	definitely	genuinely
And if you <head>really<head> want a town like that (just not awmish) come visit Tehachapi, Ca. Its paradise in the middle of the mountains, where nobody is in a hurry and everyone gets along!	really	really	actually	truly	indeed	definitely	genuinely
We <head>really<head> pushed it for " nv ".	really	really	totally	completely	truly	absolutely	unreservedly
It's not even something that I tolerate - it's <head>really<head> something I demand of people.	really	really	in fact	actually	absolutely
The teacher had yelled at her when she��d used the inhaler in class, claiming that she didn��t <head>really<head> need it.	really	really	actually	truly	absolutely
After a fire extinguisher is used, it must always be <head>returned<head> for recharging and its use recorded.	returned	send back	take back	give back	bring back	return
We <head>return<head> to the young woman who is reading the Wrigley's wrapping paper.	return	go	come back	return	revisit	revert
They always <head>returned<head> the phonecalls and were more than helpful with advice as so with the showroom and Sarah's advice.	returned	reply to	respond to	return
Click here to <head>return<head> to the booklist	return	go back	return	get back	revisit	revert	retrace
Specific vacancy search If you know the reference of a vacancy you found previously on LondonJobs, you may enter it in the specific vacancy search box to <head>return<head> the vacancy.	return	get	go back to	get back	return	retrieve
Tea tree A tea bush or plant which has been allowed to <head>return<head> to its wild state and grow back into a tree.	return	return	resume	revert	regress
You will still be responsible for the shipping and handling fees, and for the cost of <head>returning<head> the merchandise.	returning	send back	return
