Esta historia es <head>pesada<head> y compleja por un lado, pero convincente y esclarecedora por el otro. 	pesada	dificil	pesado	complicado	denso
Por el contrario, los terrenos privados alrededor de estas CA pueden experimentar un uso <head>intensivo<head> durante la temporada de armas de fuego. 	intensivo	duro	maltrato	frecuente	aciago	dificil	consetudinario	pesado	copioso
Y entiendo la sensibilidad particular en el norte de Australia en lo que respecta a las exportaciones de ganado <head>vivo<head>. 	vivo	vivo	con vida
No son la variedad <head>viva<head>, sino estatuas de bronce hechas por la escultora de 84 años que elaboró el ornitorrinco para el trofeo perpetuo del Premio Golden Paw. 	viva	vivo	vivaz	con vida	en vivo	avivado	real
Pub con música <head>en vivo<head> cuatro veces por semana, comida italiana y cerveza Guinness de barril. 	en vivo	en vivo	vivo	en directo
Al igual que el partido de Filadelfia, este evento fue cubierto en <head>vivo<head> por la World Wide Web. 	vivo	en vivo	vivo	en directo	en tiempo real
El drama se representó y grabó en Nairobi frente a una audiencia en <head>vivo<head>. 	vivo	en vivo	vivo	presente	en directo
Experto en proyectos líderes, especialmente en la implementación de sistemas de usuario final en <head>vivo<head>. 	vivo	vivo	tiempo real	directo	en vivo
Junto a su cabeza, vemos una línea eléctrica <head>viva<head>, todavía chispeando. 	viva	con energia	directo	prendido	vivo	activo	energizado	encendido	cargado
La lección en video realizada al final de la prueba debe realizarse en <head>vivo<head> y eso también lleva mucho más tiempo. 	vivo	en vivo	en tiempo real	vivo	presencial	en directo
Su anuncio estará <head>activo<head> dentro de las 5 horas posteriores al momento en que lo publicó. 	activo	presente	en linea	en exhibicion	vivo	listo	en vivo	activo	puesto	cargado
La abuela de 80 años reúne a las <head>masas<head> para luchar en una guerra nuclear. 	masas	masa	muchedumbre	multitud	gente	aglomeracion
Por lo general, carecen de la <head>masa<head> crítica para poder prestar servicios de manera rentable. 	masa	masa	volumen	masa critica	poder	multitud
Su crecimiento suele ser muy vigoroso pero proporcionan una <head>masa<head> de color en verano. 	masa	masa	cuerpo	diversidad	cantidad	aglomeracion	abundancia
Colin y su jefe están reunidos con las <head>masas<head> en la Plaza del Vaticano cuando Colin dice : Esto nunca funcionará. 	masas	masa	multitud	muchedumbre	congregacion
El tamaño, la forma y la <head>masa<head> de la roca no se consideran y se realiza una simulación cinematográfica del proceso de caída de rocas. 	masa	masa	cuerpo	volumen
Merece y necesita ser escuchado también en nuestra época, cuando la creciente riqueza de unas pocas personas es paralela a la creciente pobreza de las <head>masas<head>. 	masas	masa	multitud	populo
Aún mejor, las instrucciones paso a paso para las <head>masas<head> serían absolutamente excelentes. 	masas	masa	multitud	muchedumbre	gente	populo	congregacion
Con ese tamaño, tendría una <head>masa<head> similar a la de una galaxia promedio. 	masa	masa	cuerpo	volumen	tamano
Luego haga que los niños midan la <head>masa<head> de dos papas y las congelen. 	masa	masa	volume	tamano
De nuevo, podían escuchar <head>misa<head> con tanta reverencia que todos sus pecados fueran perdonados. 	misa	misa	servicio religioso	sermon
La preparación ideal sería una comida ligera unas 2-2 1/2 horas antes del partido, seguida de un calentamiento y tal vez una recarga con líquido extra antes del <head>partido<head>. 	partido	enfrentamiento	partido	encuentro	juego	combate
El software es el programa que analiza los millones de páginas registradas en el índice para encontrar <head>coincidencias<head> con una búsqueda y clasificarlas según lo que considera más relevante. 	coincidencias	correspondencia	igual	acierto	colision	concordancia	coincidencia	par
La etiqueta consiste en un pequeño chip, del tamaño de la cabeza de un <head>fósforo<head>, que sirve como una base de datos portátil. 	fósforo	cerillo	fosforo
El tiempo de viaje es de alrededor de 8 horas, por lo que hay mucho tiempo para sentarse, relajarse y comenzar el análisis posterior al <head>partido<head>. 	partido	partido	encuentro	enfrentamiento	juego
Otros costes (día del <head>partido<head>, campo y administración) se redujeron un 12 % con respecto a los niveles de 2001/02. 	partido	correspondencia	encuentro	enfrentamiento	partido
Esto es por lo menos 26 semanas antes de la semana en que se hace la <head>coincidencia<head> aprobada con el niño. 	coincidencia	igual	emparejamiento	coincidencia	par	pareja	concordancia	encuentro	enfrentamiento
Ella luchó, pero demostró no ser <head>rival<head> para la poderosa fuerza invisible. 	rival	igual	reto	rival	problema	resistencia	pareja	openente	equiparamiento	estar a la altura de
Parecía ser una <head>pareja<head> hecha en el cielo, excepto que Jesse estaba 	pareja	pareja	par	emparejamiento	encuentro
Encontrar la mejor <head>combinación<head> incluye : Responder a las necesidades del bebé de manera adecuada y lo antes posible. 	combinación	pareja	par	igual	concordancia	coincidencia	opcion
No obstante, ambos <head>cargos<head> incluyen un período de relevo de un año y, en consecuencia, las elecciones deben celebrarse con un año de anticipación al término de sus mandatos. 	cargos	puesto	cargo	posicion	anuncio
Detalles de la solicitud FECHA DE CIERRE : VIERNES 2 de septiembre de 2005 (Las solicitudes deben estar marcadas por <head>correo<head> en o antes de este día; no se considerarán solicitudes tardías). 	correo	enviado	mostrando	publicado	saliendo	anuncio	correo	marcado por correo
Así que puse <head>postes<head> de cerca alrededor del claro. 	postes	poste	cerco	colocando	desplegando
Y puse un segundo riel alrededor de los <head>postes<head>. 	postes	poste	cerco	tabla
Recibió 2 el otro día de AURA Mansfield a Buller ultra en el <head>correo<head> sin cargo. 	correo	correo	posicion	puesto	publicacion	anuncio
En febrero se anunció un <head>puesto<head> de consultor con un interés especial en Otología en el Hospital St Georges. 	puesto	puesto	posicion	cargo	anuncio
A la mañana siguiente llegamos al <head>puesto<head> fronterizo a las 7:30. 	puesto	caseta	puesto fronterizo	poste	correo	frontera	cerco	puesto	caseta fronteriza
Existía el peligro de que se derramaran aguas residuales <head>sin tratar<head> de una planta de alcantarillado dañada por un incendio. 	sin tratar	sin tratar	sin refinar	no tratado	aguas negras	simple	puro	aguas residuales
Propuso reducir los aranceles aduaneros sobre la lana <head>cruda<head> para prendas de vestir de un total de 25 por ciento a 20 por ciento. 	cruda	sin tratar	no tratado	simple	puro	burdo	natural	en bruto
No sólo el tamaño <head>bruto<head> del archivo XHTML no es más corto que el del archivo HTML, sino que no importaría si lo fuera, ya que ambos se comprimirían a algo del mismo tamaño. 	bruto	crudo	puro	rudo	en bruto
En Nueva Zelanda, las nueces no son una parte importante de la dieta, y la mayoría de las veces se comen en pequeñas cantidades <head>crudas<head> o como mantequilla de maní. 	crudas	crudo	natural	sin cocer	simple	sin procesar
Muchos inversores institucionales ahora están decidiendo que están recibiendo un trato <head>injusto<head> de las juntas directivas de las empresas de Australia. 	injusto	injusto	crudo	aspero	trato injusto
La belleza <head>natural<head> y natural de la costa del Sinaí es celebrada por el estilo arquitectónico único de Taba Heights Resort, una reinterpretación de un antiguo pueblo egipcio. 	natural	sin mancillar	puro	natural	crudo	silvestre	simple	inhospito	agreste	claro
La <head>cruda<head> honestidad de esa crudeza básica te hace sentir más fuerte en cierto modo. 	cruda	puro	crudo	simple	modesto	real	basico	en bruto
La herida estaba en carne <head>viva<head> y atroz, pero al menos parecía que el sangrado había disminuido, lo que Ezra esperaba que fuera una buena señal. 	viva	crudo	duro	a carne viva	aspero	abierto	en carne viva
Street Girl es una visión de la juventud venidera en los años 70 y 80, que expresa una <head>cruda<head> ira contra el mundo de los adultos, la escuela, la autoridad y la sociedad. 	cruda	puro	crudo	rudo
Si bien la calidad de la imagen sufre (los artefactos y el ruido digital abundan), la sensación <head>cruda<head> de esta imagen de hecho se suma al ambiente. 	cruda	sin tratar	crudo	simple	limpio	puro
En el año 1600, en tiempos de Shakespeare, la región del sur de las Indias Orientales era todavía tan poco conocida como siempre; los <head>toscos<head> mapas de aquellos días sólo tenían un gran espacio en blanco donde deberían haber estado las islas de Australia. 	toscos	simple	poco claro	crudo	rudimentario	no sofisticado	poco sofisticado	impreciso	burdo	sencillo
El Presidente de la Cámara, al darse cuenta de que el Primer Ministro había sido atrapado con la mano en el tarro de galletas, se unió y también comenzó a interrumpir al Excmo. Finnegan de la manera más <head>grosera<head>. 	grosera	grosero	feo	mal educado	rudo	despreciable	inapropiado	maleducado	sin educacion	descortes
La tripulación de cabina es <head>grosera<head> y poco profesional y parece tratar al pasajero que paga como una carga no deseada. 	grosera	grosero	no refinado	inepto	mal educado	rudo	impreparado	sin educacion	descortes
Desafortunadamente, esta carrera precipitada para alcanzar el nirvana a menudo resulta en un <head>rudo<head> despertar. 	rudo	inesperado	brusco	rudo	dificil	tosco
Es una noche estridente y <head>grosera<head> y seguida de una discoteca hasta la 1 am. 	grosera	duro	desenfrenado	desagradable	rudo	dificil	pesado	alocado
Caro, amante de la diversión, disfruta de las bromas; de hecho, cuanto más <head>grosero<head>, mejor, y a menudo llega al trabajo con resaca. 	grosero	grosero	indecente	cansado	duro	sin educacion	pesado
El gesto de pulgar hacia arriba es una señal positiva en la mayor parte del mundo, pero en algunas culturas se considera un gesto <head>de mala educación<head>. 	de mala educación	grosero	rudo	descortes	maleducado	sin educacion	mal educado
El uso de las campanas para fines generales y hasta religiosos es de origen muy antiguo, aunque es probable que en edades tempranas fueran de forma muy <head>tosca<head> y sonido imperfecto, y que se desarrollaron gradualmente hasta su perfección actual. 	tosca	burdo	rustico	imperfecto	tosco	crudo	mal hecho	rudimentario	sencillo	ordinario
A menos que se empleara un capital en el transporte del producto <head>rudo<head> o manufacturado desde los lugares donde abunda hasta aquellos donde se necesita, no se podría producir más de lo necesario para el consumo de la vecindad. 	rudo	crudo	no tratado	poco sofisticado	simple	natural	en bruto
“ La guerra de 1914 ”, escribió, “ fue un <head>duro<head> golpe para la religión socialista. 	duro	duro	desagradable	rudo	tosco	seco	crudo	inesperado	tremendo
Hay una pregunta que exige una respuesta, una respuesta <head>directa<head>, de aquellos que buscan liderar esta nación y su gente. 	directa	directo	concreto	espontaneo	verdadero	exacto	inmediato	sin tapujos	preciso	real
Esta fuerte cultura juvenil influyó rápidamente en otros estilos musicales con sus frases y ritmos de ruptura y dio origen a muchos estilos contrastantes, incluidos pop, funk, dance, techno, acid jazz, indie rock, etc. Un disco de rap <head>directo<head> sigue siendo duro y sólo es relevante un grupo y mercado específico, no tiene un atractivo comercial. 	directo	puro	directo	unico	simple	derecho	basico	sencillo
Lo que es seguro, pero no creo que nadie necesite esta advertencia, es que lo más importante es hacer las cosas de forma <head>correcta<head>, justa y honesta, y nunca pensar que puedes ser más astuto que Scientology por tu cuenta. 	correcta	derecho	directo	recto	correcto	al punto	legal	al grano	claro	sencillo
Soy muy <head>heterosexual<head> (con la aprobación de mi novia) y tengo la intención de seguir siéndolo. 	heterosexual	heterosexual	correcto	directo	recto	honrado
El evento se llevó a cabo en una pista de remo de 2000 m con lados <head>rectos<head>. 	rectos	derecho	recto
Debe reconocerse que la ruta ideal para un ciclo es una línea <head>recta<head> entre el origen y el destino. 	recta	recto	derecho	en linea recta	directo
El toletero de los Piratas de Pittsburgh, Paul Waner, estableció un nuevo récord de la Liga Nacional después de terminar catorce juegos <head>consecutivos<head> con al menos un hit largo (doce dobles, cinco triples, tres jonrones). 	consecutivos	seguido	consecutivo	al hilo	sin corte	sin parar	uno tras otro	junto	continuo
Sin duda, es una declaración poco política de Kerry, pero también creo que es una forma de hablar <head>claro<head> y bienvenida sobre cómo puede ganar esta elección. 	claro	directo	claro	de frente	honesto	al punto	derecho	al grano	sencillo
El mercado de valores nunca sube en línea <head>recta<head>, por lo que siempre habrá caídas. 	recta	recto	derecho	en linea recta
Las colonias de una <head>cepa<head> parecían suaves. 	cepa	variedad	cepa	cadena
Lo que pone una verdadera <head>tensión<head> en Joe y en mí, te lo aseguro) y quería que este tuviera su propia categoría. 	tensión	presion	tension	variedad	fuerza
El arroz transgénico se desempeñó mejor que la <head>cepa<head> original en celo y en la recuperación del choque térmico [ 13 ]. 	cepa	variedad	cepa	cadena
Derrite, derrite mis dolores Con tus suaves <head>tensiones<head>; Que, habiéndome dado la facilidad, Con pleno gozo dejo esta luz, Y tomo mi vuelo Hacia el Cielo. 	tensiones	torcedura	tension	propensidad	tenor	esfuerzo	estirando	jalon	tendencia
Normalmente incluyen <head>cepas<head> en circulación actual o reciente. 	cepas	tension	torcedura	variedad	esfuerzo	cadena	tirantez
La semilla para jardines sostenibles debe provenir de <head>cepas<head> antiguas y reproducibles, con la planta madre seleccionada entre las mejores. 	cepas	variedad	tipo	cepa	cadena
No estábamos haciendo el trabajo realmente duro, los griegos locales que venían a hacer el trabajo pesado estaban bajo mucha más <head>presión<head>. 	presión	presion	esfuerzo	tension
Si tiene una mala postura, sus huesos no están correctamente alineados y sus músculos, articulaciones y ligamentos soportan más <head>tensión<head> de lo previsto por la naturaleza. 	tensión	tension	esfuerzo	presion	tirantez
Estaba agradecida por el respiro porque la <head>tensión<head> en mi ego siempre presente estaba interfiriendo con mi receptividad hacia James. 	tensión	tension	paciencia	propensidad	propension	presion
Atornille el soporte y luego asegúrelo todo con una pequeña brida a través de uno de los orificios originales en la parte inferior del soporte del mapa y <head>alrededor<head> del soporte. 	alrededor	alrededor	en la circumferencia	cerca de	cerca	es los alrededores	en las circancias
A : Yo y si no estoy <head>cerca<head>, Marcus. 	cerca	cerca	por aqui	aqui	alrededor	en los rededores
La fuerza de su radiación aumenta con la altitud, al igual que sus límites, hasta que se fusiona por completo con el cinturón interior propiamente dicho a <head>unas<head> 600 millas de la superficie de la Tierra. 	unas	aproximadamente	alrededor	cerca de	cerca
Es sabroso y una gran oferta en <head>alrededor<head> de diez dólares. 	alrededor	aproximadamente	cerca de	por casi	cerca	alrededor
Quiero decir, si lo dejas correr, la gente se <head>irá<head> con una impresión negativa. 	irá	alejar	ir	desocupar	dejar un lugar
Al día siguiente, ella estaba afuera en las escaleras gritando y gritando : Nos están <head>quitando<head> nuestra tierra. 	quitando	quitar	robar	separar	despojar	retirar
Manténgalo por lo menos a 6 pulgadas <head>de distancia<head> del maletero. 	de distancia	lejos	de distancia	a una distancia de	alejado	apartado	de separacion
Espero que no hayan pensado que me he sentido <head>triste<head> toda la semana, después de la cita de la semana pasada. 	triste	triste	deprimido	desanimado	azorado	cansado	melancolico	decaido
Pero cuando Daniel se puso <head>azul<head> una vez y dejó de respirar por completo. 	azul	azul	morado	azulado	azuloso
La imagen común del cielo es la de una cúpula <head>azul<head> que nos encierra y toca la tierra en el horizonte. 	azul	azul	celeste
Como comenta Lynn Bartels en un excelente artículo para el Rocky Mountain News del 22 de enero, la senadora estatal Jennifer Veiga, demócrata de Denver, presentó el proyecto de ley 77 del Senado para derogar una sección de las leyes <head>azules<head> que prohíbe la venta de la mayoría de las bebidas alcohólicas los domingos. 	azules	ley puritana	de censura	estricto	azul
¿Utilizan tácticas de investigación, lluvia de ideas, lingüística, bases de datos, software, cielo <head>azul<head> o creación patentada? 	azul	azul	cielo azul
Los carbohidratos se quemarán rápidamente, pero luego bajará el nivel de azúcar en la sangre y comenzará a sentirse <head>triste<head> y olvidará el placer delirante que es ser un alimentador inferior. 	triste	triste	deprimido	malhumorado	debil
Falanges de prostitutas resurgen en Bourbon Street, la música llena el aire, la noche se vuelve <head>azul<head>. 	azul	azul	triste	rico
Cada vez que me ponía <head>azul<head>, ponía la canción, la subía muy fuerte y bailaba alrededor de la sala de estar durante veinte minutos y me sentía mejor. 	azul	triste	deprimido	desanimado	melancolico	malhumorado
Nunca se me puso la piel <head>azul<head> ni tuve ningún problema real con la circulación. 	azul	azul	morado	azuloso	azulado
La primera es que los botones de marcar en el formulario WEB no impiden que los encuestados <head>marquen<head> más de una respuesta a la vez. 	marquen	verificar	checar	confirmar	anotar	rectificar	revisar	comprobar
Te recomendamos que <head>consultes<head> con nosotros previamente. 	consultes	checar	verificar	revisar	corroborar	confirmar	cotejar	rectificar	comprobar
Desafortunadamente, Bear tuvo que <head>internarse<head> en un manicomio por hacer todo esto. 	internarse	internar	registrar	verificar	inscribir	revisar	solicitar admision
Muchas escuelas en el área también usan detectores de metales portátiles para <head>revisar<head> aleatoriamente a los estudiantes en busca de armas. 	revisar	checar	inspeccionar	revisar	controlar	confirmar	rectificar	verificar
Y si <head>marcamos<head> las casillas correctas en las tarjetas de votación, ¡nos acercaremos! 	marcamos	checar	revisar	confirmar	rectificar	seleccionar	verificar	tachar	pintar
Puede <head>verificar<head> el estado de su certificado de seguridad en cualquier momento durante el proceso de pago. 	verificar	checar	verificar	revisar	controlar	corroborar	confirmar	cotejar	rectificar
<head>Revisa<head> los hombros para que cuelgue bien, se detenga a la altura de las caderas o más abajo, y asegúrate de que los pantalones sean lo suficientemente largos. 	Revisa	checar	revisar	verificar	confirmar	rectificar
Hágase <head>revisar<head> su postura o fuerza muscular en una feria de salud u otro programa de evaluación gratuito. 	revisar	checar	revisar	confirmar	rectificar	verificar
He <head>comprobado<head> varias veces con mi pedido y ese no es el caso. 	comprobado	verificar	corroborar	confirmar	checar	rectificar	revisar
Los clientes que imprimieron sus propias tarjetas de embarque desde el portal de Continental pueden pasar directamente por seguridad a la puerta de embarque de su vuelo, si no tienen equipaje para <head>facturar<head>. 	facturar	revisar	documentar	registrar	checar	pasar por control	verificar
Los ancianos simplemente no pueden pagar los precios actuales, los dentistas, y no hay duda de que, si pudieran, ese atraso podría <head>eliminarse<head> muy rápidamente. 	eliminarse	liquidar	finiquitar	despejar	terminar	aclarar	reducir	eliminar	limpiar
Los hermanos McCarthy que dirigen el lugar son excelentes anfitriones, y entre ellos, su comida gourmet y una excelente sala de lectura con una chimenea bien cuidada, estoy bien atendido hasta que el clima finalmente se <head>despeje<head>. 	despeje	despejar	aclarar	mejorar	abrir	clarear	limpiar
Probablemente ni siquiera notarías los 30 autos en la pista que no sufrieron daños de ninguna manera y están listos para avanzar tan pronto como se <head>despeje<head> la pista. 	despeje	limpiar	despejar	clarear	despejar
El equipo de diseño optó por <head>despejar<head> una gran área de árboles detrás del 4 ° green para ayudar a darle al hoyo la misma sensación de dramatismo y escala que se experimenta cuando se está parado en el 10 ° tee de The Old Course en Sunningdale. 	despejar	limpiar	despejar	talar	clarear
Los pedidos estarán en espera hasta que el pago se reciba en su totalidad o <head>se borre<head> el cheque. 	se borre	pasar	saldar	pagar	aclarar	cotejar	blanquear	limpiar
Este es el punto más lejano hasta el cual los cuerpos han sido <head>limpiados<head>. 	limpiados	limpiar	salvar	sacar	despejar	remover
Los generales de la Infantería de Marina han <head>despejado<head> a otros soldados de infantería en circunstancias algo similares, como el tiroteo en Faluya, debido a la naturaleza del combate que la Infantería de Marina está presenciando en Irak. 	despejado	disipar	despejar	liquidar	retirar	asesinar	perdonar	matar	dejar libre
Cuando se pone de pie, comienza a <head>retirar<head> los platos de la mesa. 	retirar	limpiar	quitar	remover	retirar
Aquí se oponen a las ciclovías, alegando que estas ciclovías están destinadas a <head>despejar<head> las carreteras para el transporte motorizado para la comodidad de la élite automovilística. 	despejar	limpiar	despejar	remover	quitar	eliminar
Las escuelas y los sistemas también buscan el aseguramiento de la calidad mediante el uso de la evaluación para evaluar la competencia básica, <head>despedir<head> a los maestros por incompetencia y garantizar que las personas adecuadas; sean promovidas a puestos clave. 	despedir	despedir	correr	dejar sin empleo	destemplar	descartar
Si nos vemos a nosotros mismos como separados del mundo, es fácil <head>descartar<head> nuestras acciones como irrelevantes o poco probables de hacer alguna diferencia. 	descartar	rechazar	desentenderse	reconocer	demeritar	descartar
Cuando los estudiantes deben salir de la escuela por cualquier motivo durante el horario escolar, deben presentar una nota de sus padres / tutores en la oficina para su aprobación y luego a su maestro para que los <head>despidan<head> de la clase. 	despidan	dejar ir	dejar marcharse	retirar	poder irse	liberar
Por ley y por contrato, los empleados con estatus profesional no pueden ser <head>despedidos<head> si un empleado sin estatus profesional es retenido en un puesto para el cual la persona titular tiene la certificación para enseñar. 	despedidos	despedir	correr	dejar sin empleo	quitar de un puesto	desemplar
Los folletos o volantes, por brillantes que sean, tienden a ser impersonales y pueden <head>descartarse<head> como correo basura. 	descartarse	rechazar	reconocer	demeritar	descalificar
La Alternativa Mejorada del Servicio de Autobuses fue <head>desestimada<head> porque no cumpliría con el Propósito y la Necesidad del Proyecto. 	desestimada	rechazar	condenar	descalificar	retirar
Cuando los visitantes se han ido, <head>despide<head> a Suzuki y se prepara para un suicidio ceremonial. 	despide	despedir	dejar ir	correr	retirar
Simplemente agradezca a su Gremlin por su opinión, <head>despídalo<head> y pídale a su verdadera voz interior que suba el volumen. 	despídalo	dejar ir	correr	relevar	alejar	sacar	despedir	retirar
Algunos han sido multados y advertidos por la policía para que <head>despidan<head> a sus trabajadores ilegales. 	despidan	despedir	correr	dejar sin empleo	dejar ir	desemplar
Volver arriba Sindicatos Un empleado tiene derecho a afiliarse a un sindicato y no se le debe negar un trabajo, <head>despedirlo<head>, acosarlo o despedirlo por ser miembro o querer afiliarse a un sindicato. 	despedirlo	correr	despedir	rechazar	dejar sin empleo	dejar ir	desemplar
4 Cada Parte <head>llamará<head> la atención de todas las demás Partes sobre cualquier actividad que, en su opinión, afecte la implementación de los objetivos y principios de este Protocolo. 	llamará	llamar	llamar la atencion	atraer la atencion
Los datos presentados aquí <head>se extraen<head> de las preguntas relacionadas con el uso del tiempo y los roles sociales de las mujeres. 	se extraen	sacar	obtener	tomar	establecer	recopilar	crear
También ilustramos los temas <head>basándonos<head> en las historias de los colaboradores. 	basándonos	dibujar	hacer uso de	trazar	obtener inspiracion	sacar ventaja de	sacar ideas de	pintar
La Junta <head>se ha basado<head> en gran medida en los mejores cerebros del mundo de la medición educativa y ha llevado a cabo más investigaciones que cualquier otro organismo para desarrollar su sistema de certificación para profesores de práctica consumada. 	se ha basado	echar suerte	apostar	ganar	recurrir	obtener inspiracion	sacar ideas de	hacer uso de	acudir	sacar ventaja de	atraer
Dijo que no se <head>dibuja<head> un árbol así con un arbusto alrededor. 	dibuja	dibujar	trazar	bosquejar
Este grupo incluye a las personas que <head>perciben<head> un sueldo o salario por su trabajo en su propia empresa incorporada. 	perciben	extraer	ganar	percibir	cobrar	jalar	obtener
Estuvieron presentes aproximadamente 150 miembros de la comunidad de York, <head>estableciendo<head> conexiones entre las instituciones del campus y el imperio estadounidense. 	estableciendo	atraer	derivar	trazo	provocar	crear	jalar
El pueblo está bellamente situado en una ladera en la curva occidental de la bahía, y moviéndonos por los caminos vimos por primera vez el carro del Cabo <head>tirad<head>o por dieciséis bueyes. 	tirad	jalar	arrastrar	tirar	trazar	delimitar
