Durante el asedio, George Robertson había designado a Shuja-ul-Mulk, que era un niño <head>inteligente<head> de solo 12 años y el hijo menor sobreviviente de Aman-ul-Mulk, como gobernante de Chitral. 	inteligente	inteligente	brillante	listo
El campo real no es muy diferente al de un 40 mm, solo que es más pequeño y notablemente más <head>brillante<head>, lo que probablemente sea el principal beneficio. 	brillante	brillante	claro	mejor
Las rosas han crecido fuera de control, salvajes y despreocupadas, sus caras <head>brillantes<head> y florecientes se volvieron para bañarse en el sol de principios de otoño. 	brillantes	brillante	rebosante	luminoso	claro
Era <head>brillante<head>, independiente y orgulloso. 	brillante	inteligente	listo	brillante	abusado
Una velada de música sinfónica clásica, interpretada por las estrellas de la próxima generación en la escena orquestal estadounidense, se puede saborear en New World Symphony, una institución especial de Miami que nutre a los mejores y más <head>brillantes<head> jóvenes músicos sinfónicos. 	brillantes	talentoso	habilidoso	sobresaliente	brillante	virtuoso
Hay buenas razones para concluir que el panorama a largo plazo sigue siendo <head>brillante<head>, e incluso las señales recientes sobre el curso actual de la economía han pasado de ser incesantemente negativas a fines del otoño del año pasado a un conjunto de señales mucho más mixto recientemente. 	brillante	optimista	vivo	brillante	positivo	obvia	claro	vigente
Las áreas cubiertas de nieve aparecen en azul <head>brillante<head> en la imagen que se tomó a principios de la primavera y muestra una capa de nieve profunda. 	brillante	brillante	colorido	vistoso	vivido	claro
Vuelve los ojos <head>brillantes<head> de emoción hacia Fiona, todavía tirando de la cuerda de la tarjeta de miniaeronave y baile en miniatura que acaba de recibir en la puerta. 	brillantes	lleno de	pizpireta	alegre	inquieto	abierto	brillante	luminoso	brillante de emocion
Un breve extracto : Estaba orando en privado hasta que alguien tuvo la <head>brillante<head> idea de iniciar un Equipo de Oración Presidencial. 	brillante	brillante	gran	grandioso	fabuloso	excelente	bueno	preciso	correcto
Por lo tanto, a diferencia de las películas de estudio, las <head>películas<head> independientes no pueden orientarse conceptualmente a una campaña de marketing ni utilizarse para reclutar vínculos comerciales. 	películas	filme	pelicula	cinta	proyecto	largometraje	pelicula de cine independiente
A la proyección repleta de cerca de 100 personas de la prensa de alto nivel también les encantó la <head>película<head>. 	película	pelicula	filme	cinta	funcion	evento	largometraje	proyeccion
Creo que la mayoría de los cineastas en este momento están pensando en el DVD cuando comienzan la producción porque la realidad es que el DVD es donde la gran mayoría de la audiencia experimentará la <head>película<head>. 	película	pelicula	filme	produccion	cinta	largometraje
Dune hace la segunda <head>película<head> de Lynch que se estrena en formato HD de consumo (Mulholland Drive en D-VHS es la primera). 	película	pelicula	filme	produccion	proyecto	largometraje
Ciberlugar de literatura de música cinematográfica: incluye reseñas de <head>películas<head>, tableros de mensajes, sala de chat e imágenes de varias películas. 	películas	pelicula	filme	critica de cine	proyecto	filmico
Su <head>largometraje<head> prima HEROES / DE STÃ˜RSTE HELTE (1996) obtuvo premios en Rouen y Madrid. 	largometraje	pelicula	proyecto	debut cinematografico	filme
(Algunas personas mantienen sus televisores encendidos para hacer compañía). En Malta, las noticias son la principal razón por la que recurrimos a la televisión, seguidas de <head>películas<head>, programas de entrevistas, documentales, series y música, en ese orden. 	películas	pelicula	filme	largometraje
La <head>película<head> muestra a mercenarios afganos involucrados con los separatistas, lo que sugiere que la lucha actual en Cachemira ha sido secuestrada por extremistas extranjeros, a quienes se les muestra discutiendo la pérdida de Bangladesh en la guerra de 1971, proporcionándolo como una justificación para sus actuales actos de venganza.	película	pelicula	filme	cinta	largometraje
Una excelente partitura de George Fenton (EL CRUCIBLE) y una hermosa fotografía de Roger Pratt contribuyen en gran medida a la eficacia de la <head>película<head>. 	película	pelicula	filme	produccion	cinta	largometraje
El éxito de las primeras <head>películas<head> de Autry no fue suficiente para salvar a Mascot Pictures, que colapsó bajo el peso de las deudas de Consolidated Film Laboratories, que se encargaba del procesamiento de las películas de Mascot. 	películas	pelicula	cinta	filme	produccion	proyecto
Eso no quiere decir que el proceso de negociación real no se esté <head>llevando a cabo<head>. 	llevando a cabo	pasar	no se da pie a la negociacion	no se esta haciendo possible la negociacion	llevar a cabo	ocurrir	no se da lugar a la negociacion
Hugh Grant y Alan Rickman, como Edward y el coronel Brandon, respectivamente, se <head>arriesgaron<head> más y, por lo tanto, los diversos críticos aman u odian sus actuaciones. 	arriesgaron	tomar	tomar los riesgos
No debería <head>llevar<head> tanto tiempo. 	llevar	tomar	durar	prolongar	tardar	llevar
Solo afecta el tiempo de inicio de un programa, y para un proceso que <head>lleva<head> varios meses (su código estaba calculando el 196 Palindrome Quest), no importa si el código de inicialización toma 1/1,000 de segundo o 1/10,000 de segundo. 	lleva	tomar	prolongar	tardar	durar	llevar	requerir
Si <head>tomamos<head> en consideración el contexto fáctico en el que se usa el término, entonces su extensión se vuelve limitada debido al contexto. 	tomamos	tomar	considerar	tomar en consideracion
Si no <head>tome el riesgo<head> de morir conduciendo a la tienda, su casa podría derrumbarse sobre usted y matarlo de todos modos. 	tome el riesgo	tomar	tomar el riesgo	arriesgar
El gobernador <head>tomó<head> las grandes hojas de pergamino de imitación, las miró, firmó con su nombre en cada una, dejó la pluma y entregó los papeles por encima de la mesa a Dreier. 	tomó	tomar	incluir	considerar	agarrar	asir
O'Neill y los dos hombres que trabajaban bajo su supervisión mantuvieron la avenida, rastrillando la fina grava y quitando cualquier maleza que intentara <head>echar raíces<head> en la tierra pedregosa. 	echar raíces	echar raices	crear raices	arraigar	generar raices	crecer	hacer
Incluso si la cumbre anglo-francesa no <head>se llevó a cabo<head> hasta el próximo año, el primer ministro y el presidente Chirac todavía debían verse en noviembre y diciembre. 	se llevó a cabo	llevar a cabo	realizar
40 La gestión financiera y operativa diaria es responsabilidad de la Directora General, quien <head>asumió<head> su cargo en junio de 2001. 	asumió	tomar	tomar responsabilidad	asumir su cargo	tomar protesta	tomar su cargo	tomar posicion
De todos modos, mis pantalones se están poniendo <head>apretados<head>. 	apretados	encogido	apretado	pegado	aprieto	atacado	justo	estar encogiendo
Con el mercado físico tan <head>apretado<head> como lo ha estado en la memoria, la plata podría volar en cualquier momento. 	apretado	apretado	constante	fija	amarra	reducido	apuro	firme
Más... El mercado de cafés especiales está tranquilo, la oferta escasea Publicado a las 2:57 p. de hace un año, pero los precios de los frijoles selectos se mantuvieron <head>firmes<head> con escasez de suministros hasta que estén disponibles las próximas cosechas. 	firmes	escaso	estable	puntual	fija	firme
Si su dinero es <head>escaso<head>, no tome atajos. 	escaso	escaso	reducido	limitado	poco	justo
Cada niño yace dentro de una incubadora Isolette, un rectángulo de acrílico transparente con amplio espacio para un bebé prematuro de la mitad del tamaño, aunque los cuartos se vuelven <head>estrechos<head> para los ocho libras nacidos a término. 	estrechos	apretado	reducido	chico	pequeno	estrecho	limitado	justo
Puede ser intimidante al principio, porque envuelven sus brazos muy <head>fuerte<head> alrededor de ti, y todo a lo que se aferran se dirige directamente a su boca, dijo Schmitz. 	fuerte	apretado	fuerte	ajustado	duro
Las incisiones se sentirán <head>apretadas<head> durante las primeras 24 a 48 horas. 	apretadas	apretado	justo	apretar	molesto	tirante	tenso	cerrado	estirado	tieso
Excepto por los soldados, Goth estaba <head>bien<head> encerrado. 	bien	apretado	bien	fuerte	apretado	encerrado a piedra y lodo	encarcelado a piedra y lodo	seguro
Nathan Robins : Hizo bien en mantenerse <head>firme<head> en el extremo izquierdo y el árbitro lo juzgó severamente en varias ocasiones por haberle cometido una falta al jugador contrario cuando sentí que simplemente lo superó. 	firme	estatico	permanecer firme	detener	cerca	pegado	aferrado	paralizar	firme
Sé que el mercado está <head>ajustado<head> en este momento. 	ajustado	apretado	estar en aprieto	escaso	riguroso	reducido	estricto	lleno	duro	atestado	dificil
Eso no es un <head>listón<head> muy alto. 	listón	bar	barra	obstaculo
Esta posición más erguida se logra de manera más fácil y económica colocando una barra vertical en su configuración, y solo requiere que compre una barra en lugar de una <head>barra<head> y un vástago. 	barra	barra	palo	barrote	baston
Durante doce horas, Livewire transmitirá en vivo desde la <head>barra<head> azul de Union House en UEA en un intento de recaudar la mayor cantidad de dinero posible para una causa muy noble. 	barra	bar	bancada azul	cantina	taberna	cafe	seccion azul
El gobierno británico impuso una <head>prohibición<head> de color en sus colonias, por lo que los jóvenes negros solo ingresaban a la ley o la medicina donde podían ganarse la vida sin el apoyo del gobierno. 	prohibición	topes	impedimento	barra	impedimento dedido al color	barrera
Ponga las <head>barras<head> de granola en un tazón. 	barras	barra	barra de granola	granola en barra
Resumen : El análisis del contacto entre dos razas cromosómicas de ratones domésticos en el norte de Italia muestra que la selección natural producirá alelos que <head>impedirán<head> los apareamientos interraciales si la descendencia resultante son híbridos inadecuados. 	impedirán	impedir	separar	dividir	bloquear	evitar
El setenta y cinco por ciento de mi clientela que entra allí es como una persona que un viernes por la tarde entra en un <head>bar<head>, se sienta en la barra y el cantinero sabe lo que quiere beber. 	bar	bar	cantina	taberna	cafe
La noche es larga en las numerosas discotecas y clubes, pero para aquellos que buscan algo más tranquilo, hay <head>bares<head> más tranquilos y sofisticados en los hoteles. 	bares	bar	cantina	taberna	cafe
Cuando la portada de la revista Time retrata a los locos del milenio como cristianos trastornados y locos que sostienen una <head>cruz<head> como lo hizo el mes pasado, boicotee su revista y los productos que anuncia. 	cruz	cruz	cruce
Conjunto de cuatro en <head>cruz<head>, las puntas se encuentran en el agua rodeadas de medias lunas luminosas. 	cruz	cruz	cruce	interseccion
El triticale, un <head>cruce<head> entre el trigo y el centeno, madura más tarde que el centeno pero antes que el trigo. 	cruce	cruza	combinacion	mixtura	injerto	mezcla
El viejo Nick se cansó de maldecir, se sintió humillado por estar sentado encima y dolía como los tormentos del infierno por estar tan cerca de la <head>cruz<head>. 	cruz	cruz	cruce	crucero
En 1924 logró transmitir a unos pocos metros la imagen parpadeante de una <head>cruz<head> de Malta y el 26 de enero de 1926 realizó la primera demostración mundial de televisión real en su taller del ático ante unos cincuenta científicos. 	cruz	cruz	combinacion	injerto	cruza
Si se produce un ciclo de energía, se debe tener cuidado para tener en cuenta el 'tiempo muerto'; entre el apagado y el encendido cuando se evalúa la sección <head>transversal<head> del enganche. 	transversal	cruce	seccion cruzada
Las personas de raza <head>mixta<head> representan una muestra representativa diversa de herencias raciales, étnicas y culturales, con muchas personas multirraciales que se identifican con múltiples comunidades&quot; declararon las organizaciones. 	mixta	parte	seccion cruzada	cruza	cruzada	cruce
Solo puedo juzgar los teclados yendo a un lugar como PC World y probándolos físicamente, y no quiero ir a un lugar como PC World, ya que no quiero <head>enfadarme<head>. 	enfadarme	enojar	enfadar	molestar
La antigua fábrica del Sr. Hall todavía está en Oklahoma Avenue, pero la planta de fabricación de metal donde trabajaba el Sr. Larson <head>finalmente<head> cerró el año pasado después de marchitarse durante décadas. 	finalmente	finalmente	definitivamente	al final
<head>Finalmente<head>, esta nueva regla también tendrá el efecto de alentar a las corporaciones existentes a producir productos más seguros, de acuerdo con los objetivos de política pública que subyacen a la ley de responsabilidad por productos defectuosos en general. [ Fn. 	Finalmente	finalmente	por ultimo	para concluir	finalmente	como conclusion	por fin	hasta que por fin
Sin embargo, este sencillo método de limpieza ha complicado un poco el problema, ya que ahora Explorer no se borra en absoluto, mientras que los navegadores Gecko <head>finalmente<head> se han corregido para que borren todos los flotantes anteriores. 	finalmente	al fin	finalmente
<head>Finalmente<head>, Adam ve que la tarjeta de identificación se usa como autenticador porque podría declararse digno de confianza. 	Finalmente	por ultimo	finalmente	al fin	por fin	al final
Él dijo : Está bien, primero, me gustaría tener una cara como la de Clark Gable, luego, me gustaría tener una complexión como la de Arnold Schwarzenegger, y <head>finalmente<head>, me gustaría un equipo sexual como este aquí, el caballo que estoy montando. 	finalmente	por ultimo	al menos	para acabar	finalmente	al final	ademas
<head>Finalmente<head>, entrevisté a Eric Howes, un destacado investigador de spyware de la Universidad de Illinois, quien descubrió que los paquetes de software anti-spyware más populares de la actualidad son mucho menos efectivos de lo que muchos creen (consulte el recuadro a continuación). 	Finalmente	finalmente	al final	por ultimo	para concluir	finalmente	al fin	por fin
Sin embargo, el banco también le reembolsará esas tarifas NSF; solo llegará cuando <head>finalmente<head> procesen todo junto. 	finalmente	finalmente	al fin	en conclusion
<head>Finalmente<head>, el Ejército ha llevado a cabo actividades de caracterización de campos de tiro con respecto al potencial de contaminación por residuos de municiones en 17 campos de tiro en los Estados Unidos, evaluando los diferentes tipos de campos de tiro utilizados por el Ejército. 	Finalmente	finalmente	ultimamente	al fin	por fin	al final	por ultimo
<head>Finalmente<head>, se describe cómo se debe construir una teoría mesoscópica para un experimento de microscopía de túnel de barrido particular para superar la falla de un modelo de reacción-difusión correspondiente para reproducir cuantitativamente los experimentos. 	Finalmente	finalmente	por fin	al final	en conclusion	por ultimo
<head>Finalmente<head>, la regla de enajenación propuesta se aplicaría a los agentes de transferencia registrados en la Comisión. 	Finalmente	finalmente	ultimamente	por fin	en conclusion
Si te <head>encuentras<head> atrapado en pensamientos negativos y de repente esperas lo peor, será imposible rendir al máximo. 	encuentras	encontrar	presentir	sentir
Buscar reseñas de clientes 9 de 10 personas <head>encontraron<head> útil la siguiente reseña : Literatura feminista temprana - memorable, 21 de noviembre de 2000 Crítico : MJ Smith (Seattle, WA, EE. UU.) - Ver todas mis reseñas Este libro consiste en una joya de historia y una historia mediocre después. 	encontraron	encontrar	descubrir	considerar util	hallar
Bueno, tienen un amigo llamado Morgan y Morgan les dijo que <head>encontraran<head> un objeto que él quiere. 	encontraran	buscar	encontrar	identificar	hallar	localizar
De acuerdo con hallazgos previos, se <head>encontró<head> que la falta de congruencia era un precursor de la intrusión. 	encontró	encontrar	identificar	hallar	descubrir	resultar	dar como resultado
estuches para teléfonos móviles nokia, estuches para teléfonos celulares motorola, estuches para teléfonos celulares motorola, estuches para teléfonos celulares con guantes corporales Creo que el mejor lugar donde puedes <head>encontrar<head> FUNDAS PARA TRANSPORTAR TELÉFONOS CELULARES es eBay. 	encontrar	encontrar	hallar
Ah, y en cuanto a los chistes de Kool-Aid, <head>encuentra<head> tu propio material. 	encuentra	encontrar	buscar	atinar	acertar	hallar
Pero mucho de lo que una vez aceptamos como inevitable, ahora lo <head>encontramos<head> absolutamente intolerable. 	encontramos	encontrar	considerar	aparecer	hallar	sentir	percibir	creer
SpeedUpMyPC <head>encuentra<head> automáticamente la mejor configuración para su PC y controla cuidadosamente los recursos de su sistema para brindarle el mejor rendimiento. 	encuentra	encontrar	descubrir	identificar	hallar	buscar
Si Bessler realmente había descubierto alguna forma mecánica de crear un movimiento perpetuo, quizás la única forma explicable es si hubiera <head>encontrado<head> una forma de extraer la energía de este éter. 	encontrado	encontrar	descubrir	atinar	acertar	hallar	encontrar un modo de	encontrar una manera de
La gente de Meditación Trascendental anunciaba esto : La meditación puede <head>curar<head> muchas enfermedades. 	curar	curar	remediar	arreglar	componer	aliviar
Ahora, no estoy seguro de cómo pasé de faltar dos semanas a seis, pero tengo la intención de <head>arreglarlo<head> sobre la marcha. 	arreglarlo	arreglar	reparar	remediar	componer
Siento que puedo hacer mucho más como concejal siendo innovador y <head>solucionando<head> los problemas que tenemos con los flujos de efectivo, porque ocurren todos los años. 	solucionando	arreglar	reparar	componer	resolver	corregir	solucionar
Volviendo al día en que los médicos miraban a la persona en su totalidad y no esperaban que una píldora <head>arreglara<head> la mente. 	arreglara	arreglar	curar	componer
Y gracias a nuestros usuarios, ahora tenemos alrededor de 30 motores en la base de datos... Nuevas funciones : - Mejor diseño - Mejor copia - Pequeños errores <head>corregidos<head> Errores : - es decir, infierno + mucho más Publicado por eric a las 17:24 | Comentarios (3) Noticias de inversión Como parte de la nueva estrategia de expansión internacional, 24hdc.com ahora acepta USD para inversiones. 	corregidos	arreglar	reparar	remediar	solucionar	corregir
Eh, inclinado. por anna el 17 de julio de 2003 a las 15:37 sí, en nuestro caso, quienquiera que hizo la fundación la jodió como un rey. cuando la casa se asentó, fue fubar. Sin embargo, debería ser bastante fácil de <head>arreglar<head>... solo es cuestión de colocar los pilotes a las alturas correctas. por JC el 17 de julio de 2003 a las 18:32 agregar un comentario Nombre : Dirección de correo electrónico : URL : ¿Recuerda información personal? 	arreglar	arreglar	componer	solucionar	ordenar
Supongo que podré presionar el botón de activación muchas veces ya que siempre estoy en el concesionario para que <head>arreglen<head> mi automóvil. 	arreglen	arreglar	componer	reparar
El problema a largo plazo con el Seguro Social después de 2042 podría <head>solucionarse<head> por completo elevando el límite de ingresos a un nivel necesario para generar suficientes ingresos para permitir que el sistema continúe pagando el 100 por ciento indefinidamente. 	solucionarse	arreglar	componer	restaurar	resolver	rectificar	enmendar	solucionar
La única forma de <head>solucionar<head> esto es que Linux obtenga suficiente participación de mercado para poder demandar soporte de hardware. [ respuesta ] [ arriba ] [ Â » ] Publicar especificaciones es la única respuesta. por The Nose Who Knows - 26 de febrero de 2001 04:29:40 & amp;gt; La otra razón por la que los proveedores no admiten linux & amp;gt; la mayoría de las veces para hardware común como & amp;gt; La cámara web ofrece bajos rendimientos de las inversiones. 	solucionar	arreglar	componer	constituir	crear	solucionar	armar
Pero si ninguna oración puede alterar tu propósito, querido esposo, si estás tan <head>decidido<head> a ir, ¡llévame también contigo! 	decidido	decidir	arreglar	aferrar	organizar	convencer	estar decidido a	necio
De repente hubo una dispersión de fuego, que tres jardineros se llevaron la peor parte; el jardín central fue golpeado y capturado, el jardín izquierdo y derecho <head>lograron<head> volver a nuestras líneas. 	lograron	lograr	conseguir	arreglar	poder	hacer
C158 (cf ex R145)  El Provincial en Consejero el Superior de la Delegación en Consejo establece la competencia financiera de los Superiores locales y sus Consejos y determina qué bienes pueden ser <head>administrados<head> por Oblatos individuales y por Superiores locales y sus Consejos. 	administrados	manejar	disponer	controlar	administrar
Una mujer casada conserva la propiedad de cualquier propiedad que haya aportado al matrimonio, pero el esposo tiene derecho a <head>administrar<head> la propiedad y disfrutar de las ganancias de la misma. 	administrar	manejar	administrar	controlar	utilizar	dirigir	usar	hacerse cargo de	operar
No necesitamos pedir su permiso específico para hacer estas cosas, como se explica a continuación : Los proveedores de atención médica de Treatment Partners utilizarán y compartirán su información médica para brindar y <head>administrar<head> su atención médica y servicios relacionados. 	administrar	manejar	administrar	controlar	guiar	dirigir	regir	conducir	operar
Según un comunicado de prensa de la Casa Blanca, al-Taqwa y sus afiliados 'recaudan, <head>administran<head>, invierten y distribuyen fondos para al-Qaeda; brindan a los partidarios de los terroristas servicio de Internet y comunicaciones telefónicas seguras; y organizan el envío de armas'. 	administran	manejar	dirigir	controlar	administrar	operar
Es decir, si la persona promedio (digamos que esto es el 98 % de las personas) acumula 10 cosas, si <head>logro<head> adquirir 20 cosas, quizás mi cuenta no valga el doble, pero quizás 10x o 100x más que el promedio. 	logro	lograr	conseguir	poder	alcanzar	manipular	maniobrar	operar
Existen diferentes tipos de sistemas de atención <head>administrada<head>. 	administrada	guiar	administrar	llevar	manejar	sistema de cuidado de la salud	dirigir	manipular
Saddam Hussein no <head>logró<head> derrotar a los iraníes. 	logró	lograr	conseguir	poder	intentar	tener exito en	maniobrar	pretender	operar
El programa M107 está <head>gestionado<head> por el Project Manager Soldier Weapons con el apoyo de ingeniería proporcionado por el Centro de Ingeniería, Desarrollo e Investigación de Armamento de Picatinny. 	gestionado	manejar	controlar	gobernar	administrar	regir	operar	conducir	dirigir
Es realmente un plan <head>ordenado<head>, bien documentado y un modelo para las bibliotecas que todavía están trabajando en sus planes. ~ ~ ~ Correcciones a la edición de abril de 2003 de LDD On the Road : Algunas cosas pasaron desapercibidas al armar la edición del mes pasado de LDD On the Road. 	ordenado	buen	sin fallas	muy bueno	sistematico	ingenioso	estupendo	excelente	efectivo	magnifico	inteligente	preciso	sencillo
Y el premio a la idea más <head>ingeniosa<head> y sencilla se lo lleva britkid.org, un recurso para abrir los ojos de los niños a la diversidad de nuestra cultura. www.skoool.com www.nrich.maths.org.uk www.stagework.org.uk www.learningcurve.gov.uk www.britkid.org Correo electrónico Hotmail es el servicio de correo electrónico gratuito que todos conocen. 	ingeniosa	claro	efectivo	mejor	propio	simple	ingenioso
A lo largo del siglo XX, los académicos han aprendido que tales imágenes intentaban hacer que la desordenada realidad fuera más <head>ordenada<head> de lo que realmente es. 	ordenada	simple	efectivo	ingenioso
Los fuertes patrones de campo creados por los setos le dan al paisaje una apariencia <head>ordenada<head> y bien estructurada. 	ordenada	claro	wonderful	organizado	ingenioso	adecuado	simple	arreglado	limpio	ordenado
Además de una lista de cosas específicas sobre las que le gustaría que hablaran, las siguientes cosas son adiciones útiles al paquete <head>ordenado<head> que les entrega cuando les pide que escriban la carta. 	ordenado	conciso	simple	presto	propio	claro	solo	adecuado
-4 veces campeón de IROC Mark Martin Indy 500, campeón de CART e IROC, Al Unser Jr. dijo Vi a mi padre y a mi tío Bobby correr en IROC y cuando era niño pensé que sería <head>genial<head> si algún día obtendría un oportunidad de ejecutar IROC. 	genial	wonderful	padre	interesante	adecuado	muy bien	excelente	incredible	genial	propio	chido
La Sociedad para la Medicina de Emergencia Académica es un pequeño grupo <head>genial<head> de personas que se dedican a promover los intereses de la academia y la investigación en las especialidades médicas más jóvenes. 	genial	conciso	bien organizado	organizado	ordenado	bien ordenado
Un weblog de Tom Coates que piensa cosas <head>geniales<head> para Yahoo! 	geniales	claro	conciso	padre	interesante	ingenioso	cosas admirables	cosas geniales	simple	ordenado
Pero no tan extraño como los otros 35 que se acostaban con él todas las noches en una <head>ordenada<head> fila calle abajo sobre una alfombra de cajas de cartón y esteras de playa de rafia multicolor. 	ordenada	ordenado	simple	derecho	limpio	claro
